Title,Runtime (minutes),Language,Overview,Release Date,Genre,Keywords,Recommendation,Actors,Director,Stream,Buy,Rent,Production Companies,Website
Meg 2: The Trench,116,en,An exploratory dive into the deepest depths of the ocean of a daring research team spirals into chaos when a malevolent mining operation threatens their mission and forces them into a high-stakes battle for survival.,2023-08-02,"Action, Science Fiction, Horror","based on novel or book, sequel, shark, kaiju, civil action, oceans, shark cage","Barbie, Indiana Jones and the Dial of Destiny, Blue Beetle, Talk to Me, Fast X, Elemental, The Last Voyage of the Demeter, The Meg, Gran Turismo, Transformers: Rise of the Beasts, The Nun II, Spider-Man: Across the Spider-Verse, Oppenheimer, The Flash, The Equalizer 3, No Hard Feelings, Mission: Impossible - Dead Reckoning Part One, Heart of Stone, Teenage Mutant Ninja Turtles: Mutant Mayhem, Sound of Freedom, Insidious: The Red Door","Shuya Sophia Cai, Page Kennedy, Jason Statham, Sergio Peris-Mencheta, Wu Jing",Ben Wheatley,"Netflix, Max, Max Amazon Channel, Netflix basic with Ads ","Apple TV, Amazon Video, Google Play Movies, YouTube, Vudu, Microsoft Store ","Apple TV, Amazon Video, Google Play Movies, YouTube, Vudu, Microsoft Store, Spectrum On Demand ","Apelles Entertainment, Warner Bros. Pictures, di Bonaventura Pictures, CMC Pictures, DF Pictures, Onaroll Productions",https://www.themeg.movie
Dad or Mom,92,es,"Florencia and Vicente are getting divorced. When both are promoted at their jobs, they will do anything in order to do not keep custody of their children.",2023-11-30,Comedy,None,"9, Migration, Mean Girls, Papaya: Love Goddess of the Cannibals, Mom, Barbie, Parasite, Oppenheimer, Inception, Extraction, Psycho, Joker, WALL·E, Interstellar, The Batman, The Last Samurai, Who Framed Roger Rabbit, Pulp Fiction, Black Widow, Mission: Impossible - Dead Reckoning Part One, Dune","Erick Terroba García, Silvia Navarro, Axel Madrazo, Aranda Sokol, Mauricio Ochmann",Ernesto Contreras,,,,Videocine,movie_collection_data.csv
The Wild,106,ko,"Woo-chul used to be a successful boxer, but he had to go to prison because his opponent died in the middle of a match. Now that he’s been released, he intends to become a model citizen. Meanwhile, his friend Do-shik will do whatever it takes to get ahead. After choosing different paths, they will be forced to plot against and betray one another.",2023-11-15,"Crime, Action",None,"Perfect Days, Yule Log, A, Pirates Down the Street II: The Ninjas from Across, way, The Roundup: No Way Out, 13 Minutes, The Best Man, The OctoGames, Mujib: The Making of a Nation, Lord of the Streets, Adrenaline, Gabriel's Redemption: Part I, It's a Wonderful Binge, Shark Side of the Moon, Invasion of Astro-Monster, Lost Bullet 2, Paradise City, Demon Slayer: Kimetsu no Yaiba Mt. Natagumo Arc, The Tank, Beneath the Surface","Ju Seok-tae, Park Sung-woong, Oh Dal-su, Oh Dae-hwan, Seo Ji-hye",Kim Bong-han,,,,,movie_collection_data.csv
American Fiction,117,en,"A novelist fed up with the establishment profiting from ""Black"" entertainment uses a pen name to write a book that propels him into the heart of hypocrisy and the madness he claims to disdain.",2023-11-10,"Comedy, Drama","sibling relationship, boston, massachusetts, writing, race politics, satire, alzheimer's disease, dysfunctional family, pseudonym, family drama, lgbt, racial stereotype, dramedy, publishing, mother son relationship, race relations, black stories","Poor Things, Maestro, The Creator, Anatomy of a Fall, The Game, Saltburn, Wonka, Hook, Past Lives, The Holdovers, The Raid, X, The Dirt, The Zone of Interest, The Devils, One Life, Sometimes I Think About Dying, Parasite, Barbie, Inception, Oppenheimer","Leslie Uggams, John Ortiz, Sterling K. Brown, Jeffrey Wright, Erika Alexander",Cord Jefferson,"fuboTV, MGM Plus Amazon Channel, MGM Plus Roku Premium Channel, MGM Plus ","Apple TV, Amazon Video, Google Play Movies, YouTube, Vudu, Microsoft Store ","Apple TV, Amazon Video, Google Play Movies, YouTube, Vudu, Spectrum On Demand ","MRC, T-Street, 3 Arts Entertainment, Almost Infinite",https://www.mgm.com/movies/american-fiction
The Little Mermaid,135,en,"The youngest of King Triton’s daughters, and the most defiant, Ariel longs to find out more about the world beyond the sea, and while visiting the surface, falls for the dashing Prince Eric. With mermaids forbidden to interact with humans, Ariel makes a deal with the evil sea witch, Ursula, which gives her a chance to experience life on land, but ultimately places her life – and her father’s crown – in jeopardy.",2023-05-18,"Adventure, Family, Fantasy, Romance","mermaid, musical, based on fairy tale, live action remake","Barbie, Spider-Man: Across the Spider-Verse, Guardians of the Galaxy Vol. 3, Elemental, The Flash, Fast X, Transformers: Rise of the Beasts, The Super Mario Bros. Movie, John Wick: Chapter 4, The Little Mermaid, Avatar: The Way of Water, No Hard Feelings, Oppenheimer, Ant-Man and the Wasp: Quantumania, Meg 2: The Trench, My Fault, Indiana Jones and the Dial of Destiny, Miraculous: Ladybug & Cat Noir, The Movie, Dungeons & Dragons: Honor Among Thieves, Ruby Gillman, Teenage Kraken, Spider-Man: Into the Spider-Verse","Daveed Diggs, Halle Bailey, Jacob Tremblay, Awkwafina, Jonah Hauer-King",Rob Marshall,Disney Plus ,"Apple TV, Amazon Video, Google Play Movies, YouTube, Vudu, Microsoft Store ","Apple TV, Amazon Video, Google Play Movies, YouTube, Vudu, Microsoft Store, Spectrum On Demand ","Walt Disney Pictures, Lucamar Productions, Marc Platt Productions",https://movies.disney.com/the-little-mermaid-2023
Aquaman and the Lost Kingdom,124,en,"Black Manta seeks revenge on Aquaman for his father's death. Wielding the Black Trident's power, he becomes a formidable foe. To defend Atlantis, Aquaman forges an alliance with his imprisoned brother. They must protect the kingdom.",2023-12-20,"Action, Adventure, Fantasy","superhero, secret society, half-brother, sequel, revenge, dysfunctional relationship, dc extended universe (dceu), ancient evil, underwater world, vengeance, brother brother relationship","Wonka, Rebel Moon - Part One: A Child of Fire, The Hunger Games: The Ballad of Songbirds & Snakes, Migration, Wish, Aquaman, The Family Plan, Silent Night, The Marvels, Saltburn, Oppenheimer, Society of the Snow, Thanksgiving, The Creator, Lift, Barbie, Napoleon, The Beekeeper, Leave the World Behind, LOL, The Boy and the Heron","Amber Heard, Randall Park, Jason Momoa, Yahya Abdul-Mateen II, Patrick Wilson",James Wan,"Max, Max Amazon Channel ","Apple TV, Amazon Video, Google Play Movies, YouTube, Vudu, Microsoft Store ","Apple TV, Amazon Video, Google Play Movies, YouTube, Vudu, Spectrum On Demand ","Warner Bros. Pictures, The Safran Company, Atomic Monster, DC Films, Domain Entertainment",https://www.aquamanmovie.com
Past Lives,106,en,"Nora and Hae Sung, two childhood friends, are reunited in New York for one fateful week as they confront notions of destiny, love, and the choices that make a life.",2023-06-02,"Drama, Romance","new york city, immigrant, friendship, regret, language barrier, nostalgia, interracial relationship, fate, memory, playwright, childhood, childhood friends, semi autobiographical, woman director, retreat, skype, facebook, ferry, korean american, korean, asian american, independent film, facetime","Elemental, Barbie, Killers of the Flower Moon, Anatomy of a Fall, Saltburn, Maestro, The Holdovers, Oppenheimer, The Monkey King, Napoleon, Meg 2: The Trench, Talk to Me, Poor Things, Joy Ride, Aftersun, The Killer, Guy Ritchie's The Covenant, Dream Scenario, A Haunting in Venice, No Hard Feelings, Perfect Days","Greta Lee, John Magaro, Teo Yoo, Moon Seung-ah, Yim Seung-min",Celine Song,"fuboTV, Paramount+ with Showtime, Paramount Plus Apple TV Channel , Paramount+ Amazon Channel, Showtime Roku Premium Channel, Hoopla, Showtime, Showtime Apple TV Channel ","Apple TV, Amazon Video, Google Play Movies, YouTube, Vudu ","Apple TV, Amazon Video, Google Play Movies, YouTube, Vudu, Spectrum On Demand ","A24, Killer Films, 2AM, CJ ENM",https://a24films.com/films/past-lives
Ferrari,131,en,"Set during the summer of 1957. Ex-racecar driver, Enzo Ferrari, is in crisis. Bankruptcy stalks the company he and his wife, Laura, built from nothing ten years earlier. Their tempestuous marriage struggles with the mourning for one son and the acknowledgement of another.",2023-12-14,"History, Drama","husband wife relationship, biography, based on true story, racing, 1950s, cars, ferrari","Wonka, Poor Things, The Beekeeper, Next Goal Wins, Saltburn, The Marvels, The Killer, Leave the World Behind, The Boy and the Heron, Migration, The Iron Claw, Priscilla, Dogman, Coup de Chance, Rebel Moon - Part One: A Child of Fire, Anatomy of a Fall, The Hunger Games: The Ballad of Songbirds & Snakes, Killers of the Flower Moon, A Man Called Otto, Fallen Leaves, The Color Purple","Penélope Cruz, Jack O'Connell, Adam Driver, Shailene Woodley, Patrick Dempsey",Michael Mann,,"Apple TV, Amazon Video, Google Play Movies, YouTube, Vudu, Microsoft Store ","Apple TV, Amazon Video, Google Play Movies, YouTube, Vudu, Microsoft Store, Spectrum On Demand ","Forward Pass, Storyteller Productions, STXfilms, Ketchup Entertainment, Esme Grace Media, Cecchi Gori USA",https://www.ferrari-film.com/
Dark Parasite,85,es,"After a Robbery at a jewelry story, a group of robbers takes refuge with a host in a shabby apartment building in the suburbs. But they don't know that in the basement hides an obscure alien creature with telepathic powers.",2023-10-25,"Horror, Science Fiction",None,"Night of the Demons III, The Little Bather, Cannonball Run II, Montage, Hell Night, Come True, Rent-A-Pal, Next Sohee, The House by the Cemetery, The Garden of Sinners: A Study in Murder (Part 1), The Isle, Harpoon, The Cameraman, Slaughter High, The Conformist, Cassandro, Eileen, My Night at Maud's, The Golem: How He Came into the World, Scordato, Vital","David White, Désirée Giorgetti, Ottavia De Vivo, Aaron Stielstra, Michael Segal","Luca Boni, Marco Ristori",,"Amazon Video, Google Play Movies, YouTube, Vudu, Redbox ","Amazon Video, Google Play Movies, YouTube, Vudu, Redbox ","Extreme Video Snc, Lorebea Film",movie_collection_data.csv
Barbie,114,en,"Barbie and Ken are having the time of their lives in the colorful and seemingly perfect world of Barbie Land. However, when they get a chance to go to the real world, they soon discover the joys and perils of living among humans.",2023-07-19,"Comedy, Adventure","feminism, satire, patriarchy, based on toy, female protagonist, doll, fantasy world, motherhood, existentialism, woman director, mother daughter relationship, gender discrimination, barbie, secret world","Oppenheimer, The Flash, Elemental, Meg 2: The Trench, Spider-Man: Across the Spider-Verse, Indiana Jones and the Dial of Destiny, Blue Beetle, Transformers: Rise of the Beasts, Guardians of the Galaxy Vol. 3, Mission: Impossible - Dead Reckoning Part One, The Little Mermaid, The Super Mario Bros. Movie, Fast X, The Nun II, Talk to Me, Asteroid City, No Hard Feelings, Gran Turismo, Red, White & Royal Blue, John Wick: Chapter 4, Teenage Mutant Ninja Turtles: Mutant Mayhem","Issa Rae, Margot Robbie, Ariana Greenblatt, America Ferrera, Ryan Gosling",Greta Gerwig,"Max, Max Amazon Channel ","Apple TV, Amazon Video, Google Play Movies, YouTube, Vudu, Microsoft Store ","Apple TV, Amazon Video, Google Play Movies, YouTube, Vudu, Microsoft Store, Spectrum On Demand ","LuckyChap Entertainment, Heyday Films, NB/GG Pictures, Mattel, Warner Bros. Pictures",https://www.barbie-themovie.com
Simón,99,en,"Simón, a Venezuelan freedom fighter exiled in Miami, copes not only with trauma, but also deep guilt over a choice he must make: stay in Miami and start a new life, or return home to the losing fight against a tyrannical regime.",2023-04-15,Drama,"venezuela, exodus, crisis, power politics, injustice","Ultravox - Return To Eden - Live At The Roundhouse, I Want to Return Return Return, The Return, Return to Sender, Return To Salem's Cove, The Return, Return to Rajapur, Return of the Secaucus Seven, Merlin: The Return, The Return, Return of the Tooth Fairy, The Return, Transformers: Titans Return, Return to Homs, The Return of Dracula, Six Weeks to Twelve Years, Return to Zero, Return to Horror Hotel, Rate Me, Trancers II: The Return of Jack Deth, Krampus: The Return","Franklin Vírgüez, Christian McGaffney, Roberto Jaramillo, Luis Silva, Jana Nawartschi",Diego Vicentini,,,,Black Hole,http://simonmovie.com
Good Burger 2,91,en,"Dexter Reed is down on his luck after another one of his inventions fails. Ed welcomes Dex back to Good Burger with open arms and gives him his old job back. With a new crew working at Good Burger, Dex devises a plan to get back on his feet but unfortunately puts the fate of Good Burger at risk once again.",2023-11-22,"Family, Comedy","fast food restaurant, invention, loss of job, fast food, buddy comedy, out of work, job","Dumb Money, The Twin, The Boogeyman, In the Land of Saints and Sinners, Scream, Freelance, Diary of a Wimpy Kid Christmas: Cabin Fever, The Shawshank Redemption, House of Wax, Sonic the Hedgehog 2, Back on the Strip, Good Burger, Marmaduke, 2023 Back That Year Up with Kevin Hart & Kenan Thompson, Garfield's Thanksgiving, Barbie, 1, Next Sohee, Wheel of Fortune and Fantasy, Farewell to Space Battleship Yamato, Cassandro","Kamaia Fairburn, Kenan Thompson, Lil Rel Howery, Jillian Bell, Kel Mitchell",Phil Traill,"Paramount Plus, Paramount Plus Apple TV Channel , Paramount+ Amazon Channel, Paramount+ Roku Premium Channel ","Apple TV, Amazon Video, Google Play Movies, YouTube, Vudu, Microsoft Store ","Apple TV, Amazon Video, Vudu, Microsoft Store ","Artists for Artists, Nickelodeon Productions",https://www.paramountplus.com/movies/video/vzMug2ck4Gcl1gI65VWrJDGPLVjnxG0a
Anyone But You,103,en,"After an amazing first date, Bea and Ben’s fiery attraction turns ice cold — until they find themselves unexpectedly reunited at a destination wedding in Australia. So they do what any two mature adults would do: pretend to be a couple.",2023-12-21,"Comedy, Romance","australia, hiking, college, romantic comedy, based on play or musical, shakespeare in modern dress, aftercreditsstinger, duringcreditsstinger, fake dating, sister's wedding, much ado about nothing","The Beekeeper, Barbie, Granit, Deep Fear, The Iron Claw, Wonka, Aquaman and the Lost Kingdom, Society of the Snow, Leave the World Behind, Poor Things, The Boy and the Heron, The Holdovers, Freelance, The Gray Man, Dune, Indiana Jones and the Dial of Destiny, My Neighbor Totoro, The Little Mermaid, Ghosted, The Others, The Conjuring","Mia Artemis, Josh Bonello, Nat Buchanan, Sydney Sweeney, Glen Powell",Will Gluck,,"Apple TV, Amazon Video, Google Play Movies, YouTube, Vudu, Microsoft Store ","Apple TV, Amazon Video, Google Play Movies, YouTube, Vudu, Spectrum On Demand ","Olive Bridge Entertainment, Roth-Kirschenbaum Films, SK Global Entertainment, Columbia Pictures",https://www.anyonebutyou.movie
The Boy and the Heron,124,ja,"While the Second World War rages, the teenage Mahito, haunted by his mother's tragic death, is relocated from Tokyo to the serene rural home of his new stepmother Natsuko, a woman who bears a striking resemblance to the boy's mother. As he tries to adjust, this strange new world grows even stranger following the appearance of a persistent gray heron, who perplexes and bedevils Mahito, dubbing him the ""long-awaited one.""",2023-07-14,"Animation, Adventure, Fantasy","based on novel or book, loss of loved one, world war ii, education, bullying, coming of age, spirituality, poverty, teenage boy, troubled childhood, moving to a city, anime, hand drawn animation, magic world, courage","Perfect Days, Saltburn, Oppenheimer, Poor Things, Wonka, My Neighbor Totoro, Napoleon, The Hunger Games: The Ballad of Songbirds & Snakes, The Marvels, Fallen Leaves, Princess Mononoke, Anatomy of a Fall, Howl's Moving Castle, Aquaman and the Lost Kingdom, The Holdovers, Society of the Snow, Killers of the Flower Moon, From Up on Poppy Hill, Past Lives, Ponyo, Top Gun: Maverick","Masaki Suda, Yoshino Kimura, Ko Shibasaki, Soma Santoki, Aimyon",Hayao Miyazaki,,,,Studio Ghibli,https://gkids.com/films/the-boy-and-the-heron/
The Holdovers,133,en,"A curmudgeonly instructor at a New England prep school is forced to remain on campus during Christmas break to babysit the handful of students with nowhere to go. Eventually, he forms an unlikely bond with one of them — a damaged, brainy troublemaker — and with the school’s head cook, who has just lost a son in Vietnam.",2023-10-27,"Comedy, Drama","vietnam war, winter, boarding school, holiday, boston, massachusetts, 1970s, alcoholism, grief, misfit, mental illness, teacher student relationship, new england, boys' boarding school, christmas, winter break, troubled youth, loss of son, christmas time, cook","Poor Things, May December, Barbie, Perfect Days, Anatomy of a Fall, Oppenheimer, Society of the Snow, Killers of the Flower Moon, Freelance, The Killer, Wonka, Saltburn, Maestro, Leave the World Behind, Past Lives, The Hunger Games: The Ballad of Songbirds & Snakes, Napoleon, Thanksgiving, The Boy and the Heron, Dream Scenario, Io Capitano","Paul Giamatti, Brady Hepner, Dominic Sessa, Carrie Preston, Da'Vine Joy Randolph",Alexander Payne,Peacock Premium ,"Apple TV, Amazon Video, Google Play Movies, YouTube, Vudu, Microsoft Store ","Apple TV, Amazon Video, Google Play Movies, YouTube, Vudu, Microsoft Store, FlixFling, Spectrum On Demand ","Miramax, Gran Via Productions",http://focusfeatures.com/the-holdovers
Fast X,142,en,"Over many missions and against impossible odds, Dom Toretto and his family have outsmarted, out-nerved and outdriven every foe in their path. Now, they confront the most lethal opponent they've ever faced: A terrifying threat emerging from the shadows of the past who's fueled by blood revenge, and who is determined to shatter this family and destroy everything—and everyone—that Dom loves, forever.",2023-05-17,"Action, Crime, Thriller","sequel, revenge, betrayal, racing, family, cliffhanger, cars","John Wick: Chapter 4, Extraction 2, The Super Mario Bros. Movie, Guardians of the Galaxy Vol. 3, Spider-Man: Across the Spider-Verse, Transformers: Rise of the Beasts, Barbie, The Flash, The Little Mermaid, Evil Dead Rise, My Fault, Knights of the Zodiac, Meg 2: The Trench, The Equalizer 3, Mission: Impossible - Dead Reckoning Part One, Fast & Furious Presents: Hobbs & Shaw, Avatar: The Way of Water, Elemental, Guy Ritchie's The Covenant, Oppenheimer, Ant-Man and the Wasp: Quantumania","Michelle Rodriguez, John Cena, Ludacris, Vin Diesel, Tyrese Gibson",Louis Leterrier,Amazon Prime Video ,"Apple TV, Amazon Video, Google Play Movies, YouTube, Vudu, Microsoft Store ","Apple TV, Amazon Video, Google Play Movies, YouTube, Vudu, Microsoft Store, FlixFling, Spectrum On Demand ","Universal Pictures, Original Film, One Race, Perfect Storm Entertainment",https://fastxmovie.com
Creed III,116,en,"After dominating the boxing world, Adonis Creed has thrived in his career and family life. When a childhood friend and former boxing prodigy, Damian Anderson, resurfaces after serving a long sentence in prison, he is eager to prove that he deserves his shot in the ring. The face-off between former friends is more than just a fight. To settle the score, Adonis must put his future on the line to battle Damian — a fighter with nothing to lose.",2023-03-01,"Drama, Action","husband wife relationship, philadelphia, pennsylvania, sports, deaf, sequel, orphan, former best friend, ex-con, childhood friends, juvenile detention center, boxing, prodigy","A Man Called Otto, Avatar: The Way of Water, Scream VI, Shazam! Fury of the Gods, John Wick: Chapter 4, Ant-Man and the Wasp: Quantumania, Creed II, Creed, The Super Mario Bros. Movie, 65, The Pope's Exorcist, Dungeons & Dragons: Honor Among Thieves, The Whale, Puss in Boots: The Last Wish, Guardians of the Galaxy Vol. 3, Murder Mystery 2, Cocaine Bear, Evil Dead Rise, M3GAN, Black Adam, Plane","Michael B. Jordan, Jonathan Majors, Tessa Thompson, Phylicia Rashād, Mila Davis-Kent",Michael B. Jordan,"Amazon Prime Video, fuboTV, MGM Plus Amazon Channel, MGM Plus Roku Premium Channel, MGM Plus ","Apple TV, Amazon Video, Google Play Movies, YouTube, Vudu, Microsoft Store ","Apple TV, Amazon Video, Google Play Movies, YouTube, Vudu, Microsoft Store, Spectrum On Demand ","Metro-Goldwyn-Mayer, Chartoff-Winkler Productions, Proximity Media, Outlier Society",https://www.mgmstudios.com/creed-iii
Sound of Freedom,131,en,"The story of Tim Ballard, a former US government agent, who quits his job in order to devote his life to rescuing children from global sex traffickers.",2023-07-03,"Action, Drama","kidnapping, human trafficking, based on true story, child kidnapping, lost children, children in danger, colombia","The Equalizer 3, Mission: Impossible - Dead Reckoning Part One, Barbie, Gran Turismo, Oppenheimer, Expend4bles, The Nun II, Five Nights at Freddy's, Transformers: Rise of the Beasts, Boudica, Saw X, Blue Beetle, Mavka: The Forest Song, Indiana Jones and the Dial of Destiny, The Creator, Talk to Me, Nowhere, Fast X, The Hunger Games: The Ballad of Songbirds & Snakes, Meg 2: The Trench, Killers of the Flower Moon","Jim Caviezel, Mira Sorvino, Bill Camp, Kurt Fuller, Gerardo Taracena",Alejandro Gómez Monteverde,Amazon Prime Video ,"Apple TV, Amazon Video, Google Play Movies, YouTube, Vudu, Microsoft Store, Redbox ","Apple TV, Amazon Video, Google Play Movies, YouTube, Vudu, Microsoft Store, Redbox ",Santa Fe Films,https://www.soundoffreedommovie.com/
The Hunger Games: The Ballad of Songbirds & Snakes,157,en,"64 years before he becomes the tyrannical president of Panem, Coriolanus Snow sees a chance for a change in fortunes when he mentors Lucy Gray Baird, the female tribute from District 12.",2023-11-15,"Drama, Science Fiction, Action","daughter, based on novel or book, arena, fight, mentor, dystopia, riot, exploration, president, prequel, survival, murder, snow, creature, battle, fight to the death, young adult, origin story, based on young adult novel, death game, teenager","Aquaman and the Lost Kingdom, Napoleon, The Marvels, Wonka, The Hunger Games, Rebel Moon - Part One: A Child of Fire, The Family Plan, Oppenheimer, Thanksgiving, Killers of the Flower Moon, Five Nights at Freddy's, Saltburn, The Creator, There's Still Tomorrow, Silent Night, Barbie, Leave the World Behind, Wish, The Hunger Games: Mockingjay - Part 1, Family Switch, Leo","Hunter Schafer, Rachel Zegler, Peter Dinklage, Tom Blyth, Jason Schwartzman",Francis Lawrence,,"Apple TV, Amazon Video, Google Play Movies, YouTube, Vudu, Microsoft Store ","Apple TV, Amazon Video, Google Play Movies, YouTube, Vudu, Microsoft Store, FlixFling, Spectrum On Demand ","Lionsgate, Color Force, about:blank",https://hungergames.movie/
Anatomy of a Fall,152,fr,"A woman is suspected of her husband's murder, and their blind son faces a moral dilemma as the sole witness.",2023-08-23,"Thriller, Mystery, Crime","husband wife relationship, winter, bisexuality, autopsy, blind, courtroom, lgbt, death of husband, woman director, courtroom drama, mother son relationship, bisexual woman, grenoble","The Archies, Killers of the Flower Moon, Dream Scenario, Oppenheimer, Past Lives, The Creator, The Book of Solutions, Society of the Snow, Poor Things, Yannick, Wonka, Perfect Days, Saltburn, Toni, Napoleon, The Killer, The Holdovers, Priscilla, A Real Job, Barbie, Rebel Moon - Part One: A Child of Fire","Antoine Reinartz, Swann Arlaud, Milo Machado-Graner, Sandra Hüller, Samuel Theis",Justine Triet,,"Apple TV, Amazon Video, Google Play Movies, YouTube, Vudu, Microsoft Store ","Apple TV, Amazon Video, Google Play Movies, YouTube, Vudu, Microsoft Store, Spectrum On Demand ","Les Films de Pierre, Les Films Pelléas, France 2 Cinéma, Auvergne-Rhône-Alpes Cinéma",https://www.anatomyofafall.film/
One Life,109,en,"British stockbroker Nicholas Winton visits Czechoslovakia in the 1930s and forms plans to assist in the rescue of Jewish children before the onset of World War II, in an operation that came to be known as the Kindertransport.",2023-09-09,"Drama, History, War","nazi, world war ii, czechoslovakia, based on true story, nazi invasion, jewish family, kindertransport, jewish refugee, 1930s, jewish history, jews, nazi germany, jews in hiding, jewish child, jewish community","Fallen Leaves, The Boy and the Heron, Society of the Snow, Ferrari, Poor Things, Wonka, Get Out, Belfast, Maestro, The Orphanage, The Holdovers, Night Swim, Back to the Future Part II, The Velvet Queen, Fall, Sleep Tight, Amsterdam, Coup de Chance, Sing Street, The Nice Guys, There's Still Tomorrow","Helena Bonham Carter, Romola Garai, Johnny Flynn, Jonathan Pryce, Anthony Hopkins",James Hawes,,,,"See-Saw Films, MBK Productions, BBC Film, FilmNation Entertainment, Cross City Films, Lipsync Productions",movie_collection_data.csv
Vikings: Battle of Heirs,82,en,"A young Viking must come to terms with the realization that he may be the King's son, who was switched at birth, but not before others try to take his rightful place.",2023-04-28,Action,viking,"Fray, The Little Bather, Harpoon, The Human Condition I: No Greater Love, Hell Night, The Garden of Sinners: A Study in Murder (Part 1), The House by the Cemetery, Super Hybrid, Laid to Rest, Mishima: A Life in Four Chapters, Test, Night of the Creeps, Montage, Don Camillo's Last Round, Slaughter High, Long Live the Seal, Terror of Mechagodzilla, Hell, Godzilla vs. Megaguirus, Son of Godzilla, Hondo","Iris Papas, Gaston Alexander, Amber Doig-Thorne, Christabel Clark, Nazeku",Robin Keane,,Vudu ,Vudu ,ChampDog Films,movie_collection_data.csv
