Title,Runtime (minutes),Language,Overview,Release Date,Genre,Keywords,Recommendation,Actors,Director,Stream,Buy,Rent,Production Companies,Website
Carousel,93,sv,"Park manager Fiona is tasked with taking care of some former friends who won an exclusive private sneak preview of Halloween at Liseberg - a whole night, all alone in the empty park. But cotton candy, lovely rides and lots of laughter soon turn into something completely different, as they realize they are not alone in the park. And the night of dreams quickly turns into a true nightmare.",2023-10-20,Horror,None,"Child's Play, Saw X, The Smiling Man, Extraction, Joker, Oppenheimer, Barbie, Inception, Psycho, Parasite, Interstellar, Dune, Mortal Kombat, Taxi Driver, The House by the Cemetery, Star Wars: The Last Jedi, Mishima: A Life in Four Chapters, Tetsuo: The Iron Man, Pulp Fiction, 1917, Once Upon a Time... in Hollywood","Wilma Lidén, Embla Ingelman-Sundberg, Amanda Lindh, Emil Algpeus, Omar Rudberg",Simon Sandquist,,,,Scandinavian Content Group,movie_collection_data.csv
Ant-Man and the Wasp: Quantumania,125,en,"Super-Hero partners Scott Lang and Hope van Dyne, along with with Hope's parents Janet van Dyne and Hank Pym, and Scott's daughter Cassie Lang, find themselves exploring the Quantum Realm, interacting with strange new creatures and embarking on an adventure that will push them beyond the limits of what they thought possible.",2023-02-15,"Action, Adventure, Science Fiction","hero, superhero, ant, based on comic, sequel, family, superhero team, aftercreditsstinger, duringcreditsstinger, marvel cinematic universe (mcu)","The Super Mario Bros. Movie, Avatar: The Way of Water, Guardians of the Galaxy Vol. 3, The Pope's Exorcist, Shazam! Fury of the Gods, Knock at the Cabin, Black Panther: Wakanda Forever, There Are No Saints, John Wick: Chapter 4, Diabolik - Ginko Attacks, Ghosted, Creed III, Dungeons & Dragons: Honor Among Thieves, Evil Dead Rise, Scream VI, Puss in Boots: The Last Wish, Ant-Man, Ant-Man and the Wasp, 65, Fast X, Everything Everywhere All at Once","Jonathan Majors, Michelle Pfeiffer, Evangeline Lilly, Kathryn Newton, Paul Rudd",Peyton Reed,Disney Plus ,"Apple TV, Amazon Video, Google Play Movies, YouTube, Vudu, Microsoft Store, AMC on Demand ","Apple TV, Amazon Video, Google Play Movies, YouTube, Vudu, Microsoft Store, Spectrum On Demand ","Marvel Studios, Kevin Feige Productions",https://www.marvel.com/movies/ant-man-and-the-wasp-quantumania
No Hard Feelings,104,en,"On the brink of losing her childhood home, Maddie discovers an intriguing job listing: wealthy helicopter parents looking for someone to “date” their introverted 19-year-old son, Percy, before he leaves for college. To her surprise, Maddie soon discovers the awkward Percy is no sure thing.",2023-06-15,"Comedy, Romance","friendship, older woman seduces younger guy, romantic comedy, summer, new york state, teen comedy, hometown, bankruptcy, craigslist, animal shelter, socially awkward, uber, late coming of age, nude swimming, graduation party, helicopter parenting","Elemental, Barbie, Oppenheimer, Indiana Jones and the Dial of Destiny, Heart of Stone, Spider-Man: Across the Spider-Verse, Gran Turismo, Meg 2: The Trench, Fast X, The Flash, Guardians of the Galaxy Vol. 3, Mission: Impossible - Dead Reckoning Part One, The Super Mario Bros. Movie, Blue Beetle, Rebel Moon - Part One: A Child of Fire, Transformers: Rise of the Beasts, Insidious: The Red Door, Red, White & Royal Blue, Saltburn, Talk to Me, The Last Voyage of the Demeter","Andrew Barth Feldman, Matthew Broderick, Laura Benanti, Jennifer Lawrence, Natalie Morales",Gene Stupnitsky,Netflix ,"Apple TV, Amazon Video, Google Play Movies, YouTube, Vudu, Microsoft Store ","Apple TV, Amazon Video, Google Play Movies, YouTube, Vudu, Microsoft Store, Spectrum On Demand ","Excellent Cadaver, Odenkirk Provissiero Entertainment, Columbia Pictures, Saks Picture Company",https://www.nohardfeelingsmovie.com
All the Names of God,105,es,"After being implicated in a terrorist attack, Santi, a taxi driver, is taken hostage by one of the perpetrators.",2023-09-15,"Drama, Action, Thriller",None,"Society of the Snow, Saltburn, Dumb Money, Fatum, All, Barbie, Rebel Moon - Part One: A Child of Fire, Scream VI, The Creator, Tetris, No Time to Die, Expend4bles, Fair Play, A Haunting in Venice, Talk to Me, Call Me by Your Name, Margaux, Aquaman, One Hundred and One Dalmatians, Jeanne du Barry, Strange World","Nourdin Batán, Roberto Enríquez, Luis Tosar, Fernando Cayo, Inma Cuesta",Daniel Calparsoro,,,,"Tripictures, Second Gen Pictures, Wanda Visión, TVE, TeleMadrid",https://www.latidofilms.com/films/all-the-names-of-god
The Adventures,143,th,"Joy, a secretary at a large multinational company, has an online shopping problem, likes to read adventure novels and watch travel and adventure shows. She daydreams about living a life of adventure.",2023-12-22,"Romance, Comedy, Adventure",None,"Invasion of Astro-Monster, Qwerty, Hatchet III, way, Barbie in the Pink Shoes, Qwerty, Barbie Presents: Thumbelina, Barbie in A Mermaid Tale 2, Qwerty, Aquaman, Nightmare Cinema, Deadpool, Gone Mom: The Disappearance of Jennifer Dulos, Batman Unlimited: Mechs vs. Mutants, HELLO, Hello, Avatar Spirits, Hello, Barbie: Big City, Big Dreams, Magnum Opus, Barbie in Rock 'N Royals","Pongsatorn Jongwilas, Jarnnawut Jarnyaharn, Sunny Suwanmethanon, Somchai Kemglad, Matcha Mosimann",Ittisak Eusunthornwattana,Amazon Prime Video ,,,Transformation Films,movie_collection_data.csv
Expend4bles,103,en,"Armed with every weapon they can get their hands on and the skills to use them, The Expendables are the world’s last line of defense and the team that gets called when all other options are off the table. But new team members with new styles and tactics are going to give “new blood” a whole new meaning.",2023-09-15,"Action, Adventure, Thriller","sequel, nuclear bomb, cargo ship, ring","The Equalizer 3, Mission: Impossible - Dead Reckoning Part One, Five Nights at Freddy's, Fast X, The Creator, Sound of Freedom, Oppenheimer, Saw X, Retribution, A Haunting in Venice, Gran Turismo, The Killer, The Marvels, The Expendables, Blue Beetle, The Nun II, Barbie, Transformers: Rise of the Beasts, The Family Plan, Haunted Mansion, Mavka: The Forest Song","50 Cent, Sylvester Stallone, Jason Statham, Megan Fox, Dolph Lundgren",Scott Waugh,,"Apple TV, Amazon Video, Google Play Movies, YouTube, Vudu, Microsoft Store ","Apple TV, Amazon Video, Google Play Movies, YouTube, Vudu, Microsoft Store, Spectrum On Demand ","Millennium Media, Campbell Grobman Films, Lionsgate, Nu Boyana Film Studios, Templeton Media, Thunder Road, Davis Films",https://expendables.movie/
"Miraculous: Ladybug & Cat Noir, The Movie",107,fr,"After a guardian of magical jewels turns an awkward girl and a popular boy into superheroes, they can never reveal their identities — even to each other.",2023-07-05,"Animation, Fantasy, Action, Romance, Family","paris, france, superhero, musical, interracial romance, teen superhero","The Little Mermaid, Ruby Gillman, Teenage Kraken, Oppenheimer, Elemental, Spider-Man: Across the Spider-Verse, Barbie, Blue Beetle, Meg 2: The Trench, Zom 100: Bucket List of the Dead, Miraculous World: Shanghai – The Legend of Ladydragon, Resident Evil: Death Island, Miraculous World: New York, United HeroeZ, Fist of the Condor, To Catch a Killer, Mission: Impossible - Dead Reckoning Part One, Avatar: The Way of Water, Transformers: Rise of the Beasts, The Flash, Lit­tle Allan — The Human Antenna, The Monkey King, Joy Ride","Benjamin Bollen, Antoine Tomé, Alexandre N'Guyen, Fanny Bloc, Annouck Hautbois",Jeremy Zag,"Netflix, Netflix basic with Ads ",,,"The Awakening Production, SND, Fantawild, Zag Animation Studios, ON Animation Studios",https://www.netflix.com/title/81383247
Indiana Jones and the Dial of Destiny,155,en,"Finding himself in a new era, and approaching retirement, Indy wrestles with fitting into a world that seems to have outgrown him. But as the tentacles of an all-too-familiar evil return in the form of an old rival, Indy must don his hat and pick up his whip once more to make sure an ancient and powerful artifact doesn't fall into the wrong hands.",2023-06-28,"Adventure, Action","treasure hunt, ancient rome, sequel, flashback, knife fight, archaeologist, adventurer, 1960s, nazi germany, action adventure, suspenseful","Barbie, Meg 2: The Trench, Mission: Impossible - Dead Reckoning Part One, Oppenheimer, Spider-Man: Across the Spider-Verse, Elemental, Indiana Jones and the Kingdom of the Crystal Skull, Teenage Mutant Ninja Turtles: Mutant Mayhem, The Flash, Rebel Moon - Part One: A Child of Fire, Indiana Jones and the Temple of Doom, Guardians of the Galaxy Vol. 3, The Last Voyage of the Demeter, Sound of Freedom, Transformers: Rise of the Beasts, Fast X, No Hard Feelings, Blue Beetle, John Wick: Chapter 4, The Equalizer 3, Asteroid City","Harrison Ford, Olivier Richters, Boyd Holbrook, Phoebe Waller-Bridge, Mads Mikkelsen",James Mangold,Disney Plus ,"Apple TV, Amazon Video, Google Play Movies, YouTube, Vudu, Microsoft Store ","Apple TV, Amazon Video, Google Play Movies, YouTube, Vudu, Microsoft Store, Spectrum On Demand ",Lucasfilm Ltd.,https://movies.disney.com/indiana-jones-and-the-dial-of-destiny
The Inventor,92,en,"The insatiably curious and headstrong inventor Leonardo da Vinci leaves Italy to join the French court, where he can experiment freely, inventing flying contraptions, incredible machines, and study the human body. There, joined in his adventure by the audacious princess Marguerite, Leonardo will uncover the answer to the ultimate question – ""What is the meaning of it all?""",2023-09-15,"Animation, Drama, Family, History","inventor, leonardo da vinci, stop motion, historical fiction","A Haunting in Venice, The Miracle, Natale a Beverly Hills, Scooby-Doo's Spookiest Tales, The Two Missionaries, Natale a Rio, Twitches Too, G-Zombie, Paparazzi, Stop-and-Cop Interactive, American Ninja 3: Blood Hunt, Kathleen Madigan: Madigan Again, A Beautiful Wife, Come Undone, Berserk: The Golden Age Arc II - The Battle for Doldrey, Suddenly Heaven, Afire, Weekend at Bernie's II, Free Willy 2: The Adventure Home, Re-Cut, Rams","Natalie Palamides, Marion Cotillard, Matt Berry, Stephen Fry, Daisy Ridley","Jim Capobianco, Pierre-Luc Granjon",Hoopla ,"Apple TV, Amazon Video, Google Play Movies, YouTube, Vudu ","Apple TV, Amazon Video, Google Play Movies, YouTube, Vudu ","Foliascope, Leo & King, Curiosity Studio, Aerial Contrivance Workshop, SIE Films, Blue Fox Entertainment, Former Prodigy Media, Slated, Leveller Media, Tip-Top Productions, Carte Blanche, Moo Studios, Curiosity Rights, The Exchange",https://theinventorfilm.com/
Saw X,118,en,"Between the events of 'Saw' and 'Saw II', a sick and desperate John Kramer travels to Mexico for a risky and experimental medical procedure in hopes of a miracle cure for his cancer, only to discover the entire operation is a scam to defraud the most vulnerable. Armed with a newfound purpose, the infamous serial killer returns to his work, turning the tables on the con artists in his signature visceral way through devious, deranged, and ingenious traps.",2023-09-27,"Horror, Thriller","mexico city, mexico, sadism, riddle, gore, sequel, con artist, cancer, scam, serial killer, torture, drugs, survival horror, duringcreditsstinger, franchise, jigsaw, saw, death game, requel","Five Nights at Freddy's, The Exorcist: Believer, Expend4bles, The Nun II, Muzzle, Sound of Freedom, Mission: Impossible - Dead Reckoning Part One, Killers of the Flower Moon, Oppenheimer, Retribution, Blue Beetle, A Haunting in Venice, Talk to Me, Saw II, Saw, Fast X, Coco, The Killer, The Equalizer 3, Nowhere, Gran Turismo","Shawnee Smith, Renata Vaca, Tobin Bell, Steven Brand, Synnøve Macody Lund",Kevin Greutert,,"Apple TV, Amazon Video, Google Play Movies, YouTube, Vudu, Microsoft Store ","Apple TV, Amazon Video, Google Play Movies, YouTube, Vudu, Microsoft Store, FlixFling, Spectrum On Demand ","Twisted Pictures, Lionsgate",https://www.saw.movie
Skal - Fight for Survival,77,en,"My name's Arthur, a huge Internet star who's just hit 3 million subs. While in the midst of throwing an epic party to celebrate, the universe had the balls to bring on the effing apocalypse and cut my night short. What was supposed to be a perfect hangover, has turned into an epic fight for survival.",2023-11-24,"Action, Horror, Comedy, Thriller",None,,"Darren Eisenhauer, Olivia Scriven, Chris Sandiford, Evan Marsh, Mariah Inger",Benjamin Cappelletti,,Amazon Video ,Amazon Video ,Splendid Film,movie_collection_data.csv
Radical,127,en,"In a Mexican border town plagued by neglect, corruption, and violence, a frustrated teacher tries a radical new method to break through his students’ apathy and unlock their curiosity, their potential… and maybe even their genius.",2023-10-19,Drama,"teachers and students, border town","Role Play, The Boy and the Heron, Sunrise, Deadpool, Mission: Impossible - Dead Reckoning Part One, Leave the World Behind, WALL·E, Guardians of the Galaxy Vol. 3, Coco, Pulp Fiction, Aquaman and the Lost Kingdom, The Last Voyage of the Demeter, The Flash, Talk to Me, Poor Things, Napoleon, Hypnotic, The Exorcist: Believer, Guimoon: The Lightless Door, Migration, Carl's Date","Jennifer Trejo, Eugenio Derbez, Mia Fernanda Solis, Daniel Haddad, Danilo Guardiola Escobar",Christopher Zalla,,Amazon Video ,Amazon Video ,"3Pas Studios, Epic, The Lift, ViX, Videocine, Pantelion Films, Participant",https://www.radical.movie
Migration,83,en,"After a migrating duck family alights on their pond with thrilling tales of far-flung places, the Mallard family embarks on a family road trip, from New England, to New York City, to tropical Jamaica.",2023-12-06,"Animation, Action, Adventure, Comedy, Family","duck, migration, flight, anthropomorphism, family, animal, chef, overprotective father, bird","The Marvels, Aquaman and the Lost Kingdom, Wish, The Beekeeper, Wonka, Saltburn, The Three Musketeers: Milady, Oppenheimer, Society of the Snow, Chicken Run: Dawn of the Nugget, Night Swim, The Boy and the Heron, Dream Scenario, Napoleon, The Painter, Lift, Anyone But You, The Holdovers, The Equalizer 3, Barbie, Elemental","Tresi Gazal, Elizabeth Banks, Caspar Jennings, Kumail Nanjiani, Awkwafina",Benjamin Renner,,"Apple TV, Amazon Video, Google Play Movies, YouTube, Vudu, Microsoft Store ",,"Universal Pictures, Illumination",https://www.migration.movie
Guardians of the Galaxy Vol. 3,150,en,"Peter Quill, still reeling from the loss of Gamora, must rally his team around him to defend the universe along with protecting one of their own. A mission that, if not completed successfully, could quite possibly lead to the end of the Guardians as we know them.",2023-05-03,"Science Fiction, Adventure, Action","hero, superhero, mad scientist, based on comic, sequel, superhero team, space opera, raccoon, aftercreditsstinger, duringcreditsstinger, marvel cinematic universe (mcu), cosmic, outer space, chosen family","Spider-Man: Across the Spider-Verse, The Super Mario Bros. Movie, Fast X, Ant-Man and the Wasp: Quantumania, The Flash, Transformers: Rise of the Beasts, Avatar: The Way of Water, Guardians of the Galaxy Vol. 2, John Wick: Chapter 4, Dungeons & Dragons: Honor Among Thieves, Barbie, The Little Mermaid, Oppenheimer, Guardians of the Galaxy, The Guardians of the Galaxy Holiday Special, Shazam! Fury of the Gods, Evil Dead Rise, Air, Indiana Jones and the Dial of Destiny, Elemental, Mission: Impossible - Dead Reckoning Part One","Dave Bautista, Pom Klementieff, Chris Pratt, Karen Gillan, Zoe Saldaña",James Gunn,Disney Plus ,"Apple TV, Amazon Video, Google Play Movies, YouTube, Vudu, Microsoft Store ","Apple TV, Amazon Video, Google Play Movies, YouTube, Vudu, Microsoft Store ","Marvel Studios, Kevin Feige Productions",https://www.marvel.com/movies/guardians-of-the-galaxy-volume-3
Concrete Utopia,130,ko,"The world has been reduced to rubble by a massive earthquake. While no one knows for sure how far the ruins stretch, or what the cause of the earthquake may be, in the heart of Seoul there is only one apartment building left standing. It is called Hwang Gung Apartments. As time passes, outsiders start coming in to Hwang Gung Apartments trying to escape the extreme cold. Before long, the apartment residents are unable to cope with the increasing numbers. Feeling a threat to their very survival, the residents enact a special measure.",2023-08-09,"Thriller, Science Fiction, Drama","dystopia, post-apocalyptic future, based on comic, survival, apocalypse, apartment building, apartment, based on webcomic or webtoon, seoul, south korea","Ballerina, Dream, Smugglers, 12.12: The Day, Barbie, Eileen, Wonka, The Marvels, Past Lives, Fair Play, Moonfall, Asteroid City, Poor Things, Suzume, Leo, Soulmate, All of Us Strangers, Ratatouille, Red Rooms, The Cursed: Dead Man's Prey, Corner Office","Park Bo-young, Park Seo-jun, Lee Byung-hun, Park Ji-hu, Kim Sun-young",Um Tae-hwa,,,,"Lotte Entertainment, Climax Studios, BH Entertainment",movie_collection_data.csv
The Weapon,85,en,"Dallas is a one-man killing machine on a mysterious rampage. His attacks on biker gangs and meth labs anger the Vegas mob boss who’s holding Dallas’ girlfriend hostage. But who is Dallas working for? Even torture won’t make him talk, and he won’t stop until justice is served.",2023-02-17,Action,None,"La La Land, A Fistful of Dollars, EO, WALL·E, Psycho, Interstellar, Inception, The Last Samurai, Parasite, Who Framed Roger Rabbit, Deadpool, Taken, Return of the Jedi, Perfect Strangers, Scott Pilgrim vs. the World, Reservoir Dogs, Avatar, The Breakfast Club, Star Wars: The Last Jedi, Pulp Fiction, Joker","Sean Patrick Flanery, AnnaLynne McCord, Cuba Gooding Jr., Jack Kesy, Tony Schiena",Tony Schiena,,"Apple TV, Amazon Video, Google Play Movies, YouTube, Vudu ","Apple TV, Amazon Video, Google Play Movies, YouTube, Vudu ",Lionsgate,movie_collection_data.csv
Spider-Man: Across the Spider-Verse,140,en,"After reuniting with Gwen Stacy, Brooklyn’s full-time, friendly neighborhood Spider-Man is catapulted across the Multiverse, where he encounters the Spider Society, a team of Spider-People charged with protecting the Multiverse’s very existence. But when the heroes clash on how to handle a new threat, Miles finds himself pitted against the other Spiders and must set out on his own to save those he loves most.",2023-05-31,"Animation, Action, Adventure, Science Fiction","new york city, sacrifice, superhero, comic book, based on comic, sequel, romance, alternate dimension, india, alternate version, super power, brooklyn, new york city, superhero team, spider bite, super villain, cliffhanger, teen superhero, chelsea, alternate universe, teen romance, female superhero, slow burn romance, interdimensional travel, defying fate","Spider-Man: Into the Spider-Verse, Transformers: Rise of the Beasts, The Flash, The Super Mario Bros. Movie, Elemental, Guardians of the Galaxy Vol. 3, Barbie, John Wick: Chapter 4, Oppenheimer, Fast X, Indiana Jones and the Dial of Destiny, Spider-Man: No Way Home, Demon Slayer: Kimetsu no Yaiba - Tsuzumi Mansion Arc, Avatar: The Way of Water, Extraction 2, The Little Mermaid, No Hard Feelings, Puss in Boots: The Last Wish, Ant-Man and the Wasp: Quantumania, Mission: Impossible - Dead Reckoning Part One, Spider-Man","Hailee Steinfeld, Oscar Isaac, Shameik Moore, Brian Tyree Henry, Jason Schwartzman","Joaquim Dos Santos, Kemp Powers, Justin K. Thompson",Netflix ,"Apple TV, Amazon Video, Google Play Movies, YouTube, Vudu, Microsoft Store ","Apple TV, Amazon Video, Google Play Movies, YouTube, Vudu, Microsoft Store, Spectrum On Demand ","Columbia Pictures, Sony Pictures Animation, Lord Miller, Pascal Pictures, Arad Productions, Marvel Entertainment",https://www.acrossthespiderverse.movie
Trunk - Locked In,96,de,"28-year-old medicine student Malina wakes up disoriented in a locked trunk and realizes, to her horror, that she is missing more than just her memory of what happened. With her phone as the only link to the outside world, the intelligent young woman wages a desperate fight for survival while the vehicle races relentlessly toward a terrible secret.",2023-11-24,"Thriller, Action, Drama","kidnapping, claustrophobia, survival, medical student, car trunk","Jules, Deep Fear, All Fun and Games, The Unbearable Weight of Massive Talent, The Colony, Surviving Paradise: A Family Tale, Passengers, Compulsion, Barbie, Wheel of Fortune and Fantasy, 1, Next Sohee, The Portable Door, Oppenheimer, Mission: Impossible - Dead Reckoning Part One, The Last Heretic, Parasite, Elemental, Cassandro, Gran Turismo, Vanquish","Luise Helm, Artjom Gilz, Poal Cairo, Charles Rettinghaus, Sina Martens",Marc Schießer,Amazon Prime Video ,,,Outside the Club,https://www.outsidetheclub.de/en/projects/trunk/
Trolls Band Together,91,en,"When Branch's brother, Floyd, is kidnapped for his musical talents by a pair of nefarious pop-star villains, Branch and Poppy embark on a harrowing and emotional journey to reunite the other brothers and rescue Floyd from a fate even worse than pop-culture obscurity.",2023-10-12,"Animation, Family, Music, Fantasy, Comedy","pop star, brother, musical, sequel, based on toy, troll, duringcreditsstinger, reunite, sister sister relationship, brother brother relationship, jukebox musical","Leo, Oppenheimer, Five Nights at Freddy's, The Creator, The Marvels, Trolls World Tour, Freelance, Wonka, The Super Mario Bros. Movie, Leave the World Behind, Saw X, Rebel Moon - Part One: A Child of Fire, Aquaman and the Lost Kingdom, Avatar: The Way of Water, Gran Turismo, Puss in Boots: The Last Wish, Elemental, Transformers: Rise of the Beasts, Fast X, Turning Red, The Hunger Games: The Ballad of Songbirds & Snakes","Justin Timberlake, Amy Schumer, Camila Cabello, Anna Kendrick, Eric André",Walt Dohrn,,"Apple TV, Amazon Video, Google Play Movies, YouTube, Vudu, Microsoft Store ","Apple TV, Amazon Video, Google Play Movies, YouTube, Vudu, Microsoft Store, FlixFling, Spectrum On Demand ","DreamWorks Animation, dentsu",https://www.dreamworks.com/movies/trolls-band-together
Who'll Stop the Rain,114,zh,"In 1994, a girl called Wei participates in a student strike that fights for creative freedom. There she meets a girl and a boy,Qing and Guang, who are the leaders of the strike. They used to be lovers until Wei appears in their world. As the protest lasts several weeks, different voices rise between Qing and Guang. One day Qing kisses Wei and everything starts to change and be unstable. Their love-hate struggle mixed with homosexual romance undermines their trust and makes the movement fall apart…",2023-10-27,Drama,None,"Fight!, Return, way, Fight!! Spirit of the Sword, It's a Wonderful Binge, Return, Return, Return, RED, (re)kindle, Return, Re-Existences, The Latin Explosion: A New America, Return, Box, Red, With a Right to Kill, The Wild Soccer Bunch 4, Hey Qween - Holigay Special, Re-Cycling, Doraemon: Nobita's Little Star Wars 2021","Ling-Wei Lee, Huang Li Feng, Hsiao-Fei Yeh, Anan Chang, Roy Chang",I-Hsuan Su,,,,"Suz Creative Studio, Outland Film Production, CONTENT DIGITAL FILM CO., LTD",movie_collection_data.csv
Dogman,115,en,"A boy, bruised by life, finds his salvation through the love of his dogs.",2023-09-27,"Action, Drama, Crime","violent father, singing, dog, gangsters, dogs","Killers of the Flower Moon, The Creator, There's Still Tomorrow, The Beekeeper, Anatomy of a Fall, Saw X, El Conde, The Animal Kingdom, Oppenheimer, Gran Turismo, Expend4bles, Asteroid City, Fallen Leaves, Io Capitano, The Palace, The Predator, Back to the Future, All Your Faces, The Wonderful Story of Henry Sugar, New Beginnings, Triangle of Sadness","Caleb Landry Jones, Jojo T. Gibbs, Christopher Denham, Grace Palma, Clemens Schick",Luc Besson,,,,"LBP, TF1 Films Production, Kinology, EuropaCorp, Apollo Films, TF1, Canal+, Ciné+, TMC, Le Pacte, RAI Cinema, Archimede, Luc Besson Production",https://www.dogmanthefilm.com/
Gran Turismo,135,en,The ultimate wish-fulfillment tale of a teenage Gran Turismo player whose gaming skills won him a series of Nissan competitions to become an actual professional racecar driver.,2023-08-09,"Adventure, Action, Drama","based on true story, racing, based on video game, duringcreditsstinger, intense, exhilarated","Blue Beetle, Mission: Impossible - Dead Reckoning Part One, Sound of Freedom, The Equalizer 3, Barbie, Oppenheimer, Meg 2: The Trench, The Nun II, Expend4bles, No One Will Save You, Talk to Me, Nowhere, Five Nights at Freddy's, Indiana Jones and the Dial of Destiny, Teenage Mutant Ninja Turtles: Mutant Mayhem, The Creator, Spider-Man: Across the Spider-Verse, PAW Patrol: The Mighty Movie, Transformers: Rise of the Beasts, Retribution, A Haunting in Venice","Djimon Hounsou, Darren Barnet, David Harbour, Orlando Bloom, Archie Madekwe",Neill Blomkamp,Netflix ,"Apple TV, Amazon Video, Google Play Movies, YouTube, Vudu, Microsoft Store ","Apple TV, Amazon Video, Google Play Movies, YouTube, Vudu, Microsoft Store, Spectrum On Demand ","PlayStation Productions, 2.0 Entertainment, Columbia Pictures",https://www.granturismo.movie
