Title,Runtime (minutes),Language,Overview,Release Date,Genre,Keywords,Actors,Director,Stream,Buy,Rent,Production Companies,Website
Deep Fear,84,English,A solo trip aboard a yacht takes a terrifying turn when a woman encounters three drug traffickers clinging to the shattered remains of a boat. They soon force her to dive into shark-infested waters to retrieve kilos of cocaine from the sunken wreck.,2023-10-18,"Horror, Thriller, Action, Mystery",shark,"Mãdãlina Ghenea, Stany Coppet, Macarena Gómez, Ibrahima Gueye, Ed Westwick",Marcus Adams,"Netflix, Netflix basic with Ads ","Apple TV, Amazon Video, Vudu, Microsoft Store ","Apple TV, Amazon Video, Vudu, Microsoft Store ","Brilliant Pictures, Ashland Hill Media Finance, Media Finance Capital, Lipsync Productions, Dark Shark Film, Canal+",movie_collection_data.csv
Mavka: The Forest Song,99,Ukrainian,"Forest soul Mavka faces an impossible choice between her heart and her duty as guardian to the Heart of the Forest, when she falls in love with the talented young human musician Lukas.",2023-03-02,"Animation, Adventure, Family, Fantasy","based on novel or book, fairy, nature, folklore, based on myths, legends or folklore, mavka, ukrainian folklore, independent film, love vs duty","Nataliia Denysenko, Oleh Skrypka, Artem Pyvovarov, Nazar Zadniprovskyi, Olena Kravets","Oleg Malamuzh, Oleksandra Ruban",Hulu ,"Apple TV, Amazon Video, Google Play Movies, YouTube, Vudu, Microsoft Store ","Apple TV, Amazon Video, Google Play Movies, YouTube, Vudu, Microsoft Store ","Animagrad Animation Studio, 3Beep, FILM.UA Group",https://mavka.ua
Silent Night,104,English,"A tormented father witnesses his young son die when caught in a gang's crossfire on Christmas Eve. While recovering from a wound that costs him his voice, he makes vengeance his life's mission and embarks on a punishing training regimen in order to avenge his son's death.",2023-11-30,"Action, Crime, Thriller, Drama","holiday, revenge, death of son, christmas, no dialogue","Valeria Santaella, Harold Torres, Kid Cudi, Joel Kinnaman, Catalina Sandino Moreno",John Woo,,"Apple TV, Amazon Video, Google Play Movies, YouTube, Vudu, Microsoft Store ","Apple TV, Amazon Video, Google Play Movies, YouTube, Vudu, Microsoft Store, FlixFling, Spectrum On Demand ","Thunder Road, Capstone Group, A Better Tomorrow Films",movie_collection_data.csv
Poor Things,142,English,"Brought back to life by an unorthodox scientist, a young woman runs off with a debauched lawyer on a whirlwind adventure across the continents. Free from the prejudices of her times, she grows steadfast in her purpose to stand for equality and liberation.",2023-12-07,"Science Fiction, Romance, Comedy","ship, london, england, experiment, paris, france, based on novel or book, obsession, lisbon, portugal, crooked lawyer, love, domestic abuse, female protagonist, doctor, prostitution, cruelty, scientist, disfigured face, exploring sexuality, sex worker, female empowerment, female sexuality, disturbed, brain transplant, absurdism, quest for knowledge, spousal abuse, women's liberation, alexandria egypt, victorian era, quest for identity, frankenstein, body horror, provocative, porn","Mark Ruffalo, Willem Dafoe, Ramy Youssef, Jerrod Carmichael, Emma Stone",Yorgos Lanthimos,Hulu ,"Apple TV, Amazon Video, Google Play Movies, YouTube, Vudu, Microsoft Store ","Apple TV, Amazon Video, Google Play Movies, YouTube, Vudu, Spectrum On Demand ","Searchlight Pictures, Film4 Productions, TSG Entertainment, Element Pictures",https://www.searchlightpictures.com/films/poor-things
Anatomy of a Fall,152,French,"A woman is suspected of her husband's murder, and their blind son faces a moral dilemma as the sole witness.",2023-08-23,"Thriller, Mystery, Crime","husband wife relationship, winter, bisexuality, autopsy, blind, courtroom, lgbt, death of husband, woman director, curious, aggressive, candid, courtroom drama, mother son relationship, anxious, clinical, bisexual woman, grenoble, ambiguous, ambivalent, complicated","Swann Arlaud, Milo Machado-Graner, Antoine Reinartz, Samuel Theis, Sandra Hüller",Justine Triet,,"Apple TV, Amazon Video, Google Play Movies, YouTube, Vudu, Microsoft Store ","Apple TV, Amazon Video, Google Play Movies, YouTube, Vudu, Microsoft Store ","Les Films de Pierre, Les Films Pelléas, France 2 Cinéma, Auvergne-Rhône-Alpes Cinéma",https://www.anatomyofafall.film/
The Wild,106,Korean,"Woo-chul used to be a successful boxer, but he had to go to prison because his opponent died in the middle of a match. Now that he’s been released, he intends to become a model citizen. Meanwhile, his friend Do-shik will do whatever it takes to get ahead. After choosing different paths, they will be forced to plot against and betray one another.",2023-11-15,Action,None,"Park Sung-woong, Ju Seok-tae, Oh Dal-su, Oh Dae-hwan, Seo Ji-hye",Kim Bong-han,,,,,movie_collection_data.csv
Saw X,118,English,"Between the events of 'Saw' and 'Saw II', a sick and desperate John Kramer travels to Mexico for a risky and experimental medical procedure in hopes of a miracle cure for his cancer, only to discover the entire operation is a scam to defraud the most vulnerable. Armed with a newfound purpose, the infamous serial killer returns to his work, turning the tables on the con artists in his signature visceral way through devious, deranged, and ingenious traps.",2023-09-27,"Horror, Thriller","mexico city, mexico, sadism, riddle, gore, sequel, con artist, cancer, scam, serial killer, torture, drugs, survival horror, duringcreditsstinger, franchise, jigsaw, saw, death game, requel","Synnøve Macody Lund, Tobin Bell, Steven Brand, Renata Vaca, Shawnee Smith",Kevin Greutert,,"Apple TV, Amazon Video, Google Play Movies, YouTube, Vudu, Microsoft Store ","Apple TV, Amazon Video, Google Play Movies, YouTube, Vudu, Microsoft Store, FlixFling, Spectrum On Demand ","Twisted Pictures, Lionsgate",https://www.saw.movie
Ghosted,117,English,"Salt-of-the-earth Cole falls head over heels for enigmatic Sadie—but then makes the shocking discovery that she's a secret agent. Before they can decide on a second date, Cole and Sadie are swept away on an international adventure to save the world.",2023-04-18,"Action, Comedy, Romance","mission, cia, biological weapon, secret agent, love, bio organic weapon, spies","Ana de Armas, Chris Evans, Mike Moh, Amy Sedaris, Adrien Brody",Dexter Fletcher,Apple TV Plus ,,,Skydance Media,https://tv.apple.com/movie/umc.cmc.6nodv9rf3ltfk2ar3pfc8hced
TAYLOR SWIFT | THE ERAS TOUR,169,English,"The cultural phenomenon continues on the big screen! Immerse yourself in this once-in-a-lifetime concert film experience with a breathtaking, cinematic view of the history-making tour.",2023-10-13,Music,"musician, pop music, concert film, singer-songwriter, aftercreditsstinger, duringcreditsstinger","Max Bernstein, Paul Sidoti, Amos Heller, Taylor Swift, Mike Meadows",Sam Wrench,Disney Plus ,,,"Taylor Swift Productions, Silent House Productions",https://www.tstheerastourfilm.com
Expend4bles,103,English,"Armed with every weapon they can get their hands on and the skills to use them, The Expendables are the world’s last line of defense and the team that gets called when all other options are off the table. But new team members with new styles and tactics are going to give “new blood” a whole new meaning.",2023-09-15,"Action, Adventure, Thriller","sequel, nuclear bomb, cargo ship, ring","Jason Statham, 50 Cent, Sylvester Stallone, Dolph Lundgren, Megan Fox",Scott Waugh,,"Apple TV, Amazon Video, Google Play Movies, YouTube, Vudu, Microsoft Store ","Apple TV, Amazon Video, Google Play Movies, YouTube, Vudu, Microsoft Store, Spectrum On Demand ","Millennium Media, Campbell Grobman Films, Lionsgate, Nu Boyana Film Studios, Templeton Media, Thunder Road, Davis Films",https://expendables.movie/
Concrete Utopia,130,Korean,"The world has been reduced to rubble by a massive earthquake. While no one knows for sure how far the ruins stretch, or what the cause of the earthquake may be, in the heart of Seoul there is only one apartment building left standing. It is called Hwang Gung Apartments. As time passes, outsiders start coming in to Hwang Gung Apartments trying to escape the extreme cold. Before long, the apartment residents are unable to cope with the increasing numbers. Feeling a threat to their very survival, the residents enact a special measure.",2023-08-09,"Thriller, Science Fiction, Drama","dystopia, post-apocalyptic future, based on comic, survival, apocalypse, apartment building, apartment, based on webcomic or webtoon, seoul, south korea","Lee Byung-hun, Park Seo-jun, Kim Sun-young, Park Bo-young, Park Ji-hu",Um Tae-hwa,,,,"Climax Studios, BH Entertainment",movie_collection_data.csv
Barbie,114,English,"Barbie and Ken are having the time of their lives in the colorful and seemingly perfect world of Barbie Land. However, when they get a chance to go to the real world, they soon discover the joys and perils of living among humans.",2023-07-19,"Comedy, Adventure","feminism, satire, patriarchy, based on toy, female protagonist, doll, submissive, fantasy world, motherhood, existentialism, woman director, mother daughter relationship, playful, gender discrimination, barbie, secret world, hopeful","Ryan Gosling, Issa Rae, Ariana Greenblatt, Margot Robbie, America Ferrera",Greta Gerwig,"Max, Max Amazon Channel ","Apple TV, Amazon Video, Google Play Movies, YouTube, Vudu, Microsoft Store ","Apple TV, Amazon Video, Google Play Movies, YouTube, Vudu, Microsoft Store, Spectrum On Demand ","LuckyChap Entertainment, Heyday Films, NB/GG Pictures, Mattel, Warner Bros. Pictures",https://www.barbie-themovie.com
The Marvels,105,English,"Carol Danvers, aka Captain Marvel, has reclaimed her identity from the tyrannical Kree and taken revenge on the Supreme Intelligence. But unintended consequences see Carol shouldering the burden of a destabilized universe. When her duties send her to an anomalous wormhole linked to a Kree revolutionary, her powers become entangled with that of Jersey City super-fan Kamala Khan, aka Ms. Marvel, and Carol’s estranged niece, now S.A.B.E.R. astronaut Captain Monica Rambeau. Together, this unlikely trio must team up and learn to work in concert to save the universe.",2023-11-08,"Science Fiction, Adventure, Action","hero, superhero, space travel, based on comic, sequel, teenage girl, aftercreditsstinger, duringcreditsstinger, marvel cinematic universe (mcu), space adventure, cheerful, enchant, hopeful","Iman Vellani, Brie Larson, Samuel L. Jackson, Zawe Ashton, Teyonah Parris",Nia DaCosta,Disney Plus ,"Apple TV, Amazon Video, Google Play Movies, YouTube, Vudu, Microsoft Store ","Apple TV, Amazon Video, Google Play Movies, YouTube, Vudu, Microsoft Store, Spectrum On Demand ","Marvel Studios, Kevin Feige Productions",https://www.marvel.com/movies/the-marvels
Killers of the Flower Moon,206,English,"When oil is discovered in 1920s Oklahoma under Osage Nation land, the Osage people are murdered one by one—until the FBI steps in to unravel the mystery.",2023-10-18,"Crime, History, Drama","husband wife relationship, based on novel or book, war veteran, fbi, greed, oklahoma, manipulation, native american, based on true story, murder, racism, series of murders, genocide, period drama, courtroom, guilt, true crime, oil industry, death of sister, catholicism, uncle nephew relationship, catholic guilt, hopeless, 1920s, osage indian, gullibility, poisoning, diabetes, anxious, revisionist western, meta, western, gloomy","Robert De Niro, Leonardo DiCaprio, Scott Shepherd, Jesse Plemons, Lily Gladstone",Martin Scorsese,Apple TV Plus ,"Apple TV, Amazon Video, Google Play Movies, YouTube, Vudu, Microsoft Store ",,"Apple Studios, Imperative Entertainment, Sikelia Productions, Appian Way",https://www.paramountmovies.com/movies/killers-of-the-flower-moon
Five Nights at Freddy's,110,English,"Recently fired and desperate for work, a troubled young man named Mike agrees to take a position as a night security guard at an abandoned theme restaurant: Freddy Fazbear's Pizzeria. But he soon discovers that nothing at Freddy's is what it seems.",2023-10-25,"Horror, Mystery","night shift, child murder, restaurant, custody battle, child in peril, orphan, security guard, based on video game, duringcreditsstinger, troubled past, child neglect, animatronic, abandoned building, brother sister relationship, ghost child, child abduction","Piper Rubio, Elizabeth Lail, Mary Stuart Masterson, Josh Hutcherson, Matthew Lillard",Emma Tammi,Amazon Prime Video ,"Apple TV, Amazon Video, Google Play Movies, YouTube, Vudu, Microsoft Store ","Apple TV, Amazon Video, Google Play Movies, YouTube, Vudu, Microsoft Store, FlixFling, Spectrum On Demand ","Blumhouse Productions, Scott Cawthon Productions",https://www.fivenightsatfreddys.movie
The Exorcist: Believer,111,English,"Since his wife's death, Victor has raised his daughter Angela alone. After she and her friend return from a three-day disappearance with missing memories, they begin displaying frightening behavior reminiscent of the MacNeil possession fifty years prior.",2023-10-04,Horror,"faith, exorcism, possession, sequel, disappearance, death of mother, exorcist, reboot, demonic possession, father daughter relationship","Leslie Odom Jr., Lidya Jewett, Jennifer Nettles, Olivia O'Neill, Ann Dowd",David Gordon Green,Peacock Premium ,"Apple TV, Amazon Video, Google Play Movies, YouTube, Vudu, Microsoft Store ","Apple TV, Amazon Video, Google Play Movies, YouTube, Vudu, Microsoft Store, FlixFling, Spectrum On Demand ","Universal Pictures, Blumhouse Productions, Morgan Creek Entertainment, Rough House Pictures",https://www.theexorcistbeliever.movie
The Equalizer 3,109,English,"Robert McCall finds himself at home in Southern Italy but he discovers his friends are under the control of local crime bosses. As events turn deadly, McCall knows what he has to do: become his friends' protector by taking on the mafia.",2023-08-30,"Action, Thriller, Crime","italy, vigilante justice, italian mafia","David Denman, Dakota Fanning, Denzel Washington, Eugenio Mastrandrea, Gaia Scodellaro",Antoine Fuqua,Netflix ,"Apple TV, Amazon Video, Google Play Movies, YouTube, Vudu, Microsoft Store ","Apple TV, Amazon Video, Google Play Movies, YouTube, Vudu, Microsoft Store, Spectrum On Demand ","Columbia Pictures, Eagle Pictures, Escape Artists, ZHIV Productions",https://www.equalizer.movie
Indiana Jones and the Dial of Destiny,155,English,"Finding himself in a new era, and approaching retirement, Indy wrestles with fitting into a world that seems to have outgrown him. But as the tentacles of an all-too-familiar evil return in the form of an old rival, Indy must don his hat and pick up his whip once more to make sure an ancient and powerful artifact doesn't fall into the wrong hands.",2023-06-28,"Adventure, Action","treasure hunt, ancient rome, sequel, flashback, knife fight, archaeologist, adventurer, 1960s, nazi germany, action adventure, suspenseful","Harrison Ford, Mads Mikkelsen, Phoebe Waller-Bridge, Olivier Richters, Boyd Holbrook",James Mangold,Disney Plus ,"Apple TV, Amazon Video, Google Play Movies, YouTube, Vudu, Microsoft Store ","Apple TV, Amazon Video, Google Play Movies, YouTube, Vudu, Microsoft Store, Spectrum On Demand ",Lucasfilm Ltd.,https://movies.disney.com/indiana-jones-and-the-dial-of-destiny
One Life,109,English,"British stockbroker Nicholas Winton visits Czechoslovakia in the 1930s and forms plans to assist in the rescue of Jewish children before the onset of World War II, in an operation that came to be known as the Kindertransport.",2023-09-09,"Drama, History, War","nazi, world war ii, czechoslovakia, based on true story, nazi invasion, jewish family, kindertransport, jewish refugee, 1930s, jewish history, jews, nazi germany, jews in hiding, jewish child, jewish community","Helena Bonham Carter, Johnny Flynn, Anthony Hopkins, Jonathan Pryce, Romola Garai",James Hawes,,,,"See-Saw Films, MBK Productions, BBC Film, FilmNation Entertainment, Cross City Films, Lipsync Productions",movie_collection_data.csv
Leave the World Behind,142,English,A family's getaway to a luxurious rental home takes an ominous turn when a cyberattack knocks out their devices—and two strangers appear at their door.,2023-11-22,"Drama, Mystery","based on novel or book, blackout, crisis, vacation, deer, apocalypse, family, house rental","Farrah Mackenzie, Myha’la Herrold, Julia Roberts, Ethan Hawke, Mahershala Ali",Sam Esmail,"Netflix, Netflix basic with Ads ",,,"Esmail Corp, Red Om Films, Higher Ground",https://www.netflix.com/title/81314956
"The Pig, the Snake and the Pigeon",134,Chinese,"The arrogant, third most-wanted criminal in Taiwan, decides to get rid of the top two competitors and crowns himself the most-wanted criminal before dying.",2023-10-06,"Action, Crime","violence, action, crime","Chen Yi-Wen, Gingle Wang, Cherry Hsieh, Ethan Juan, Ben Yuen Foo-Wah",Wong Ching-Po,"Netflix, Netflix basic with Ads ",,,An Attitude Production,https://directorymovies.com/the-pig-the-snake-and-the-pigeon
Blue Beetle,128,English,"Recent college grad Jaime Reyes returns home full of aspirations for his future, only to find that home is not quite as he left it. As he searches to find his purpose in the world, fate intervenes when Jaime unexpectedly finds himself in possession of an ancient relic of alien biotechnology: the Scarab.",2023-08-16,"Action, Science Fiction, Adventure","armor, superhero, family relationships, family, high tech, job hunting, mexican american, aftercreditsstinger, duringcreditsstinger, immigrant family, college graduate, dc extended universe (dceu), alien technology, brother sister relationship, latino","Xolo Mariduena, Bruna Marquezine, Susan Sarandon, Raoul Max Trujillo, Belissa Escobedo",Ángel Manuel Soto,"Max, Max Amazon Channel ","Apple TV, Amazon Video, Google Play Movies, YouTube, Vudu, Microsoft Store ","Apple TV, Amazon Video, Google Play Movies, YouTube, Vudu, Microsoft Store, Spectrum On Demand ","Warner Bros. Pictures, The Safran Company, DC Films",https://www.dc.com/bluebeetle
Shazam! Fury of the Gods,130,English,"Billy Batson and his foster siblings, who transform into superheroes by saying ""Shazam!"", are forced to get back into action and fight the Daughters of Atlas, who they must stop from using a weapon that could destroy the world.",2023-03-15,"Comedy, Action, Fantasy","superhero, end of the world, super power, aftercreditsstinger, duringcreditsstinger, dc extended universe (dceu), teenager","Zachary Levi, Rachel Zegler, Adam Brody, Jack Dylan Grazer, Asher Angel",David F. Sandberg,"Netflix, Max, Max Amazon Channel, Netflix basic with Ads ","Apple TV, Amazon Video, Google Play Movies, YouTube, Vudu, Microsoft Store, AMC on Demand ","Apple TV, Amazon Video, Google Play Movies, YouTube, Vudu, Microsoft Store, Spectrum On Demand ","New Line Cinema, The Safran Company, DC Films",movie_collection_data.csv
When Evil Lurks,99,Spanish,"Residents of a small rural town discover that a demon is about to be born among them. They desperately try to escape before the evil is born, but it may be too late.",2023-10-05,"Horror, Thriller","farm, small town, shotgun, village, possession, gore, goat, demon, police officer, dog, ex-wife, evil, brother brother relationship, brutal violence","Demián Salomón, Emilio Vodanovich, Ezequiel Rodríguez, Silvina Sabater, Virginia Garófalo",Demián Rugna,"AMC Plus Apple TV Channel , AMC+ Amazon Channel, AMC+, Shudder, Shudder Amazon Channel, Shudder Apple TV Channel ","Apple TV, Amazon Video, Google Play Movies, YouTube, Vudu ","Apple TV, Amazon Video, Google Play Movies, YouTube, Vudu, Microsoft Store, Spectrum On Demand ","Machaco Films, La Puerta Roja, Aramos Cine, Shudder, Cine Argentino, INCAA",movie_collection_data.csv
Dad or Mom,92,Spanish,"Florencia and Vicente are getting divorced. When both are promoted at their jobs, they will do anything in order to do not keep custody of their children.",2023-11-30,Comedy,None,"Silvia Navarro, Erick Terroba García, Aranda Sokol, Mauricio Ochmann, Axel Madrazo",Ernesto Contreras,,,,Videocine,movie_collection_data.csv
Past Lives,106,English,"Nora and Hae Sung, two childhood friends, are reunited in New York for one fateful week as they confront notions of destiny, love, and the choices that make a life.",2023-06-02,"Drama, Romance","new york city, immigrant, friendship, regret, language barrier, nostalgia, interracial relationship, fate, memory, playwright, childhood, childhood friends, semi autobiographical, woman director, retreat, skype, facebook, ferry, korean american, korean, asian american, independent film, facetime","John Magaro, Moon Seung-ah, Yim Seung-min, Teo Yoo, Greta Lee",Celine Song,"fuboTV, Paramount+ with Showtime, Paramount Plus Apple TV Channel , Paramount+ Amazon Channel, Showtime Roku Premium Channel, Hoopla ","Apple TV, Amazon Video, Google Play Movies, YouTube, Vudu ","Apple TV, Amazon Video, Google Play Movies, YouTube, Vudu, Spectrum On Demand ","A24, Killer Films, 2AM, CJ ENM",https://a24films.com/films/past-lives
John Wick: Chapter 4,170,English,"With the price on his head ever increasing, John Wick uncovers a path to defeating The High Table. But before he can earn his freedom, Wick must face off against a new enemy with powerful alliances across the globe and forces that turn old friends into foes.",2023-03-22,"Action, Thriller, Crime","new york city, martial arts, hitman, sequel, organized crime, osaka, japan, blindness, aftercreditsstinger, hunted, consequences, professional assassin, neo-noir, berlin, intense","Keanu Reeves, Ian McShane, Bill Skarsgård, Donnie Yen, Laurence Fishburne",Chad Stahelski,"Starz Apple TV Channel, Starz Roku Premium Channel, Starz, Starz Amazon Channel ","Apple TV, Amazon Video, Google Play Movies, YouTube, Vudu, Microsoft Store ","Apple TV, Amazon Video, Google Play Movies, YouTube, Vudu, Microsoft Store ","Thunder Road, 87Eleven, Summit Entertainment, Studio Babelsberg",https://johnwick.movie
Squealer,99,English,"When young women begin to disappear across a small town, a police officer and a street-smart social worker follow clues to a remote pig farm and discover the local butcher has been bringing his work home.",2023-11-03,"Horror, Thriller",None,"Tyrese Gibson, Wes Chatham, Katherine Moennig, Theo Rossi, Ronnie Gene Blevins",Andy Armstrong,Peacock Premium ,"Apple TV, Google Play Movies, YouTube, Vudu, Microsoft Store ","Apple TV, Google Play Movies, YouTube, Vudu, Microsoft Store, FlixFling, Spectrum On Demand ",Grindstone Entertainment Group,https://www.lionsgate.com/movies/squealer
Dora: Say Hola to Adventure!,45,English,"It’s Dora, the world’s most famous exploradora, like you’ve never seen her before! Join her and ALL her friends for BRAND NEW, magical adventures in the rainforest!",2023-11-10,"Animation, Family",None,"Diana Zermeño, Asher Colton Spence, Marc Weiner",Don Kim,"Paramount Plus, Paramount Plus Apple TV Channel  ",,,,movie_collection_data.csv
