Title,Runtime (minutes),Language,Overview,Release Date,Genre,Keywords,Recommendation,Actors,Director,Stream,Buy,Rent,Production Companies,Website
Napoleon,158,en,"An epic that details the checkered rise and fall of French Emperor Napoleon Bonaparte and his relentless journey to power through the prism of his addictive, volatile relationship with his wife, Josephine.",2023-11-22,"Drama, History, War","empire, france, general, biography, napoleon bonaparte, based on true story, napoleonic wars, 19th century, 1790s, biopic, violence","Society of the Snow, Wonka, The Hunger Games: The Ballad of Songbirds & Snakes, Oppenheimer, Lift, Killers of the Flower Moon, The Marvels, Aquaman and the Lost Kingdom, Barbie, Leave the World Behind, The Killer, There's Still Tomorrow, Godzilla Minus One, A Haunting in Venice, Saltburn, Wish, Indiana Jones and the Dial of Destiny, Anatomy of a Fall, Five Nights at Freddy's, Thanksgiving, The Boy and the Heron","Joaquin Phoenix, Mark Bonnar, Rupert Everett, Tahar Rahim, Vanessa Kirby",Ridley Scott,Apple TV Plus ,"Apple TV, Amazon Video, Google Play Movies, YouTube, Vudu, Microsoft Store ",,"Apple Studios, Scott Free Productions",https://www.napoleon.movie
Deep Fear,84,en,A solo trip aboard a yacht takes a terrifying turn when a woman encounters three drug traffickers clinging to the shattered remains of a boat. They soon force her to dive into shark-infested waters to retrieve kilos of cocaine from the sunken wreck.,2023-10-18,"Horror, Thriller, Action, Mystery",shark,"The Beekeeper, Granit, Napoleon, Anyone But You, Wonka, Barbie, Oppenheimer, Elemental, Leave the World Behind, Extraction, Aquaman and the Lost Kingdom, Awake, Talk to Me, Society of the Snow, Poor Things, The Last Voyage of the Demeter, Nobody, Harry Potter and the Philosopher's Stone, 2067, The Black Demon, Willow","Ibrahima Gueye, Macarena Gómez, Ed Westwick, Mãdãlina Ghenea, Stany Coppet",Marcus Adams,"Netflix, Netflix basic with Ads ","Apple TV, Amazon Video, Vudu, Microsoft Store ","Apple TV, Amazon Video, Vudu, Microsoft Store ","Brilliant Pictures, Ashland Hill Media Finance, Media Finance Capital, Lipsync Productions, Dark Shark Film, Canal+",movie_collection_data.csv
PAW Patrol: The Mighty Movie,92,en,"A magical meteor crash lands in Adventure City and gives the PAW Patrol pups superpowers, transforming them into The Mighty Pups.",2023-09-21,"Animation, Family, Action, Science Fiction, Comedy, Drama, Adventure","superhero, cartoon, mad scientist, sequel, dog, animal, elasticity, kids","Mission: Impossible - Dead Reckoning Part One, Gran Turismo, Barbie, The Marvels, PAW Patrol: The Movie, Meg 2: The Trench, Teenage Mutant Ninja Turtles: Mutant Mayhem, The Equalizer 3, Nowhere, Mortal Kombat Legends: Cage Match, Spider-Man: Across the Spider-Verse, Five Nights at Freddy's, Retribution, Killers of the Flower Moon, 57 Seconds, Sound of Freedom, Dumb Money, Freelance, Desperation Road, Uri: The Surgical Strike, Avatar: The Way of Water","Christian Convery, Taraji P. Henson, Lil Rel Howery, Kristen Bell, Mckenna Grace",Cal Brunker,"Paramount Plus, Paramount Plus Apple TV Channel , Paramount+ Amazon Channel, MGM Plus Roku Premium Channel ","Apple TV, Amazon Video, Google Play Movies, YouTube, Vudu, Microsoft Store ","Apple TV, Amazon Video, Google Play Movies, YouTube, Vudu, Microsoft Store, FlixFling, Spectrum On Demand ","Nickelodeon Movies, Spin Master, Paramount, Mikros Image",https://www.pawpatrol.movie
The Family Plan,119,en,"Dan Morgan is many things: a devoted husband, a loving father, a celebrated car salesman. He's also a former assassin. And when his past catches up to his present, he's forced to take his unsuspecting family on a road trip unlike any other.",2023-12-14,"Action, Comedy","assassin, las vegas, family, duringcreditsstinger, hidden identity, family trip, roadtrip, former soldier, father and son","Rebel Moon - Part One: A Child of Fire, The Hunger Games: The Ballad of Songbirds & Snakes, Wonka, The Creator, Society of the Snow, Silent Night, Leave the World Behind, Aquaman and the Lost Kingdom, Chicken Run: Dawn of the Nugget, Thanksgiving, Saltburn, Freelance, Lift, Family Switch, Barbie, Finestkind, Leo, Sound of Freedom, Oppenheimer, Fast X, Migration","Michelle Monaghan, Van Crosby, Zoe Colletti, Maggie Q, Mark Wahlberg",Simon Cellan Jones,Apple TV Plus ,,,"Municipal Pictures, Skydance Media",https://tv.apple.com/movie/umc.cmc.6o6y3wel2lez2tkdu2cv8dzd1
My Fault,117,es,"Noah must leave her city, boyfriend, and friends to move into William Leister's mansion, the flashy and wealthy husband of her mother Rafaela. As a proud and independent 17 year old, Noah resists living in a mansion surrounded by luxury. However, it is there where she meets Nick, her new stepbrother, and the clash of their strong personalities becomes evident from the very beginning.",2023-06-08,"Drama, Romance","stepbrother, female protagonist, stepsister, rise, enemies to lovers, passion and romance, car","Through My Window: Across the Sea, Beautiful Disaster, Fast X, Barbie, Extraction 2, Red, White & Royal Blue, The Little Mermaid, Elemental, Spider-Man: Across the Spider-Verse, Guardians of the Galaxy Vol. 3, Through My Window, Perfect Addiction, No Hard Feelings, Oppenheimer, Meg 2: The Trench, After, Purple Hearts, Sound of Freedom, Avatar: The Way of Water, Transformers: Rise of the Beasts, The Super Mario Bros. Movie","Marta Hazas, Nicole Wallace, Gabriel Guevara, Eva Ruiz, Iván Sánchez",Domingo González,Amazon Prime Video ,,,"Pokeepsie Films, Amazon Studios",movie_collection_data.csv
Due Justice,98,en,An attorney with a military past hunts down the gang who killed his wife and took his daughter.,2023-11-24,"Crime, Thriller, Action","crime boss, vigilante, crime syndicate, murder of family, vengeance, revenge thriller, vigilante justice, organ trafficking, attorney, abducted daughter","Mission: Impossible - Ghost Protocol, Silent Night, The Island, Reacher - Prime Premiere, Parasite, Joker, WALL·E, Oppenheimer, Interstellar, Psycho, Black Widow, Extraction, Who Framed Roger Rabbit, Once Upon a Time... in Hollywood, Top Gun: Maverick, Perfect Strangers, Blonde, Promising Young Woman, Barbie, The Batman, La La Land","Efren Ramirez, Kellan Lutz, Jeff Fahey, Manu Intiraymi, William Forsythe",Javier Reyna,,"Apple TV, Amazon Video, Google Play Movies, YouTube, Vudu, Microsoft Store ","Apple TV, Amazon Video, Google Play Movies, YouTube, Vudu, Microsoft Store, Spectrum On Demand ","Premiere Entertainment Group, Al Bravo Films, BondIt Media Capital, Quenaco Films",movie_collection_data.csv
Rebel Moon - Part One: A Child of Fire,134,en,"When a peaceful colony on the edge of the galaxy finds itself threatened by the armies of the tyrannical Regent Balisarius, they dispatch Kora, a young woman with a mysterious past, to seek out warriors from neighboring planets to help them take a stand.",2023-12-15,"Science Fiction, Drama, Action","space war, space, space opera, space adventure, action hero, alien spaceship, super hero girls, space vessel","Aquaman and the Lost Kingdom, Saltburn, The Family Plan, The Hunger Games: The Ballad of Songbirds & Snakes, Leave the World Behind, Society of the Snow, Thanksgiving, Silent Night, Oppenheimer, Wonka, Lift, Killers of the Flower Moon, The Creator, Spider-Man: Across the Spider-Verse, The Killer, Barbie, Gran Turismo, Fast X, The Marvels, Saw X, Transformers: Rise of the Beasts","Djimon Hounsou, Michiel Huisman, Bae Doona, Ed Skrein, Sofia Boutella",Zack Snyder,"Netflix, Netflix basic with Ads ",,,"The Stone Quarry, Grand Electric",https://www.rebelmoon70mm.com
Teenage Mutant Ninja Turtles: Mutant Mayhem,100,en,"After years of being sheltered from the human world, the Turtle brothers set out to win the hearts of New Yorkers and be accepted as normal teenagers through heroic acts. Their new friend April O'Neil helps them take on a mysterious crime syndicate, but they soon get in over their heads when an army of mutants is unleashed upon them.",2023-07-31,"Animation, Comedy, Action, Science Fiction","new york city, sibling relationship, skateboarding, crime fighter, superhero, turtle, ninja, nostalgic, duringcreditsstinger, teenage mutant ninja turtles, aspiring journalist, anthropomorphic animal, excited, exhilarated","Barbie, Blue Beetle, Spider-Man: Across the Spider-Verse, Talk to Me, Gran Turismo, Indiana Jones and the Dial of Destiny, John Wick: Chapter 4, The Last Voyage of the Demeter, Meg 2: The Trench, Oppenheimer, The Flash, A Haunting in Venice, The Nun II, The Little Mermaid, Mission: Impossible - Dead Reckoning Part One, Elemental, The Super Mario Bros. Movie, Heart of Stone, The Creator, Asteroid City, The Equalizer 3","Brady Noon, Ayo Edebiri, Micah Abbey, Nicolas Cantu, Shamon Brown Jr.",Jeff Rowe,"Amazon Prime Video, fuboTV, MGM Plus Amazon Channel, Paramount Plus, Paramount Plus Apple TV Channel , Paramount+ Amazon Channel, MGM Plus Roku Premium Channel, MGM Plus ","Apple TV, Amazon Video, Google Play Movies, YouTube, Vudu, Microsoft Store ","Apple TV, Amazon Video, Google Play Movies, YouTube, Vudu, Microsoft Store, FlixFling, Spectrum On Demand ","Paramount, Nickelodeon Movies, Point Grey Pictures, Cinesite Animation, Mikros Animation",https://www.teenagemutantninjaturtlesmovie.com
Fear,98,en,An author's celebration with friends at a woodland cabin takes a terrifying turn when an airborne virus emerges at the same time supernatural forces target the group.,2023-01-27,"Horror, Drama","survival, mountain cabin, pandemic","M3GAN, Brightburn, The Nun II, The Running Man, Silent Night, Vacation Friends 2, Last Shift, Fear, The Unseen, Barbie, Inception, Parasite, Oppenheimer, Deadpool, Interstellar, WALL·E, The Last Samurai, Avatar, Black Widow, Extraction, Psycho","Iddo Goldberg, Andrew Bachelor, Joseph Sikora, Ruby Modine, Annie Ilonzeh",Deon Taylor,"Starz Apple TV Channel, Starz Roku Premium Channel, Starz, Starz Amazon Channel ","Apple TV, Amazon Video, YouTube, Vudu ","Apple TV, Amazon Video, YouTube, Vudu ",Hidden Empire Film Group,https://fear.movie
Godzilla Minus One,125,ja,"Postwar Japan is at its lowest point when a new crisis emerges in the form of a giant monster, baptized in the horrific power of the atomic bomb.",2023-11-03,"Science Fiction, Horror, Action","monster, loss of loved one, giant monster, kamikaze, duty, atomic bomb test, radioactivity, naval combat, reboot, kaiju, duringcreditsstinger, post war japan, 1940s, naval battle, naval battleship, found family, godzilla, war orphan, survivor guilt, tokusatsu","Poor Things, Leave the World Behind, The Boy and the Heron, Shin Godzilla, Wonka, Saltburn, Rebel Moon - Part One: A Child of Fire, Aquaman and the Lost Kingdom, Napoleon, Barbie, Top Gun: Maverick, Spider-Man: Across the Spider-Verse, The Creator, John Wick: Chapter 4, Totally Killer, Ferrari, The Marvels, The Family Plan, Past Lives, Godzilla: King of the Monsters, Freelance","Minami Hamabe, Kuranosuke Sasaki, Hidetaka Yoshioka, Ryunosuke Kamiki, Yuki Yamada",Takashi Yamazaki,,,,"TOHO, TOHO Studios, Robot Communications",https://tickets.godzilla.com
Scream VI,123,en,"Following the latest Ghostface killings, the four survivors leave Woodsboro behind and start a fresh chapter.",2023-03-08,"Horror, Crime, Thriller","mask, new york city, trauma, halloween, college, fake identity, sequel, conspiracy theory, revenge, public murder, murder, social commentary, serial killer, police corruption, slasher, whodunit, multiple stabbings, brutality, killing spree, self-referential, crime spree, aftercreditsstinger, movie fan, copycat killer, generation z, fbi agent","John Wick: Chapter 4, Scream, Evil Dead Rise, Dungeons & Dragons: Honor Among Thieves, Shazam! Fury of the Gods, Ant-Man and the Wasp: Quantumania, The Super Mario Bros. Movie, Scream, Cocaine Bear, Knock at the Cabin, The Pope's Exorcist, The Whale, Creed III, 65, Guardians of the Galaxy Vol. 3, Ghosted, M3GAN, Renfield, Scream 4, Fast X, Scream 2","Jack Champion, Jasmin Savoy Brown, Melissa Barrera, Mason Gooding, Jenna Ortega","Matt Bettinelli-Olpin, Tyler Gillett","fuboTV, Paramount Plus, Paramount Plus Apple TV Channel , Paramount+ Roku Premium Channel, Showtime, Showtime Apple TV Channel ","Apple TV, Google Play Movies, YouTube, Vudu, Microsoft Store, AMC on Demand ","Apple TV, Google Play Movies, YouTube, Vudu, Microsoft Store, AMC on Demand, Spectrum On Demand ","Radio Silence, Project X Entertainment, Spyglass Media Group, Paramount",https://www.paramountmovies.com/movies/scream-vi
The Marvels,105,en,"Carol Danvers, aka Captain Marvel, has reclaimed her identity from the tyrannical Kree and taken revenge on the Supreme Intelligence. But unintended consequences see Carol shouldering the burden of a destabilized universe. When her duties send her to an anomalous wormhole linked to a Kree revolutionary, her powers become entangled with that of Jersey City super-fan Kamala Khan, aka Ms. Marvel, and Carol’s estranged niece, now S.A.B.E.R. astronaut Captain Monica Rambeau. Together, this unlikely trio must team up and learn to work in concert to save the universe.",2023-11-08,"Science Fiction, Adventure, Action","hero, superhero, space travel, based on comic, sequel, teenage girl, aftercreditsstinger, duringcreditsstinger, marvel cinematic universe (mcu), space adventure","The Hunger Games: The Ballad of Songbirds & Snakes, Wonka, Aquaman and the Lost Kingdom, The Killer, Napoleon, Five Nights at Freddy's, The Creator, Wish, Oppenheimer, Killers of the Flower Moon, Migration, Leave the World Behind, A Haunting in Venice, Captain Marvel, Barbie, Rebel Moon - Part One: A Child of Fire, The Equalizer 3, Saltburn, Lift, Elemental, Role Play","Iman Vellani, Brie Larson, Teyonah Parris, Zawe Ashton, Samuel L. Jackson",Nia DaCosta,Disney Plus ,"Apple TV, Amazon Video, Google Play Movies, YouTube, Vudu, Microsoft Store ","Apple TV, Amazon Video, Google Play Movies, YouTube, Vudu, Microsoft Store, Spectrum On Demand ","Marvel Studios, Kevin Feige Productions",https://www.marvel.com/movies/the-marvels
Dora: Say Hola to Adventure!,45,en,"It’s Dora, the world’s most famous exploradora, like you’ve never seen her before! Join her and ALL her friends for BRAND NEW, magical adventures in the rainforest!",2023-11-10,"Animation, Family",None,,"Asher Colton Spence, Diana Zermeño, Marc Weiner",Don Kim,"Paramount Plus, Paramount Plus Apple TV Channel  ",,,,movie_collection_data.csv
Wonka,117,en,"Willy Wonka – chock-full of ideas and determined to change the world one delectable bite at a time – is proof that the best things in life begin with a dream, and if you’re lucky enough to meet Willy Wonka, anything is possible.",2023-12-06,"Comedy, Family, Fantasy","chocolate, musical, prequel, duringcreditsstinger, cartel","Aquaman and the Lost Kingdom, The Marvels, Migration, The Hunger Games: The Ballad of Songbirds & Snakes, Saltburn, Oppenheimer, Napoleon, Leave the World Behind, Rebel Moon - Part One: A Child of Fire, Willy Wonka & the Chocolate Factory, Killers of the Flower Moon, Wish, The Boy and the Heron, Charlie and the Chocolate Factory, Barbie, Society of the Snow, Chicken Run: Dawn of the Nugget, Leo, Lift, The Super Mario Bros. Movie, Five Nights at Freddy's","Paterson Joseph, Hugh Grant, Timothée Chalamet, Calah Lane, Keegan-Michael Key",Paul King,"Max, Max Amazon Channel ","Apple TV, Amazon Video, Google Play Movies, YouTube, Vudu, Microsoft Store ","Apple TV, Amazon Video, Google Play Movies, YouTube, Vudu ","Warner Bros. Pictures, Village Roadshow Pictures, The Roald Dahl Story Company, Heyday Films, Domain Entertainment",https://www.wonkamovie.com
The Zone of Interest,105,en,"The commandant of Auschwitz, Rudolf Höss, and his wife Hedwig, strive to build a dream life for their family in a house and garden next to the camp.",2023-12-15,"History, Drama, War","husband wife relationship, based on novel or book, nazi, concentration camp, holocaust (shoah), world war ii, auschwitz-birkenau concentration camp, garden, biography, based on true story, nazi officer, genocide, 1940s, commandant, complicity","Fallen Leaves, Ferrari, Napoleon, Poor Things, EXmas, Oppenheimer, No Dogs or Italians Allowed, Joker, Anatomy of a Fall, Indiana Jones and the Dial of Destiny, Badland Hunters, Happening, May December, Little Women, Decision to Leave, The Holdovers, Maestro, Kidnapped, All About Lily Chou-Chou, The Teachers' Lounge, American Fiction","Nele Ahrensmeier, Luis Noah Witte, Johann Karthaus, Christian Friedel, Sandra Hüller",Jonathan Glazer,,"Apple TV, Amazon Video, Google Play Movies, YouTube, Vudu, Microsoft Store ","Apple TV, Amazon Video, Google Play Movies, YouTube, Vudu, Spectrum On Demand ","A24, Film4 Productions, Access Entertainment, PISF, JW Films, Extreme Emotions",https://a24films.com/films/the-zone-of-interest
Who Invited Charlie?,101,en,"Phil Schreiber, a self-involved hedge fund manager living in New York City, escapes to the Hamptons with his wife and son at the beginning of the COVID-19 pandemic. Making an already fraught situation worse is the surprise arrival of Phil’s college roommate Charlie, an exemplar of Falstaffian excess.  As Charlie makes himself at home, secrets are revealed that threaten to do more harm than the virus they’re all trying to avoid.",2023-02-03,Comedy,None,"Strays, My Fault, The Last Heretic, Next Sohee, 1, Cassandro, Burning Days, 4 Horsemen: Apocalypse, Wheel of Fortune and Fantasy, Endangered Species, Children of the Corn, Appearances, Battle for Saipan, The Twin, Kingdom 2: Far and Away, Deadstream, Freestyle, Harpoon, About Dry Grasses, The Tunnel to Summer, the Exit of Goodbyes, Winter Boy","Jordana Brewster, Xosha Roquemore, Peter Dager, Adam Pally, Reid Scott",Xavier Manrique,"Starz Apple TV Channel, Starz Roku Premium Channel, Starz, Starz Amazon Channel ","Apple TV, Amazon Video, Google Play Movies, YouTube, Vudu ","Apple TV, Amazon Video, Google Play Movies, YouTube, Vudu, Spectrum On Demand ","Perry Street Pictures, Blind Bulldog Films",movie_collection_data.csv
Mavka: The Forest Song,99,uk,"Forest soul Mavka faces an impossible choice between her heart and her duty as guardian to the Heart of the Forest, when she falls in love with the talented young human musician Lukas.",2023-03-02,"Animation, Adventure, Family, Fantasy","based on novel or book, fairy, nature, folklore, based on myths, legends or folklore, mavka, ukrainian folklore, independent film, love vs duty","Shamshera, Meg 2: The Trench, Barbie, Guardians of the Galaxy Vol. 3, Elemental, The Flash, Transformers: Rise of the Beasts, Red, White & Royal Blue, Miraculous: Ladybug & Cat Noir, The Movie, Wish, Hidden Strike, Sexual Chronicles of a French Family, Encanto, Oppenheimer, Spider-Man: Across the Spider-Verse, Mission: Impossible - Dead Reckoning Part One, Blue Beetle, The Three Musketeers: D'Artagnan, Heart of Stone, The Little Mermaid, A Haunting in Venice","Nazar Zadniprovskyi, Artem Pyvovarov, Oleh Skrypka, Nataliia Denysenko, Olena Kravets","Oleksandra Ruban, Oleg Malamuzh",Hulu ,"Apple TV, Amazon Video, Google Play Movies, YouTube, Vudu, Microsoft Store ","Apple TV, Amazon Video, Google Play Movies, YouTube, Vudu, Microsoft Store ","Animagrad Animation Studio, 3Beep, FILM.UA Group",https://mavka.ua
Ruthless,93,en,"A high school coach, whose teenage daughter was murdered, takes matters into his own hands by going after the men who kidnap his students for their sex trafficking operation.",2023-12-14,"Action, Thriller","human trafficking, wrestling coach, las vegas, sex trafficking, high school student, death of daughter, sex ring, high school coach","For Better Weather, The Bricklayer, Interface, Appearances, Invasion of Astro-Monster, The House by the Cemetery, Wheel of Fortune and Fantasy, Endangered Species, Crawlers, Next Sohee, 1, The Portable Door, Hell House LLC II: The Abaddon Hotel, Rabid, Teddy, Coolie No. 1, The Little Switzerland, Lone Wolf and Cub: Sword of Vengeance, Detective vs. Sleuths, The Last Heretic, Mother's Day","Mauricio Mendoza, Dermot Mulroney, Melissa Diaz, Niko Foster, Jeff Fahey",Art Camacho,,"Apple TV, Amazon Video, Google Play Movies, YouTube, Vudu, Microsoft Store ","Apple TV, Amazon Video, Google Play Movies, YouTube, Vudu, Microsoft Store, Spectrum On Demand ",Premiere Entertainment Group,movie_collection_data.csv
John Wick: Chapter 4,170,en,"With the price on his head ever increasing, John Wick uncovers a path to defeating The High Table. But before he can earn his freedom, Wick must face off against a new enemy with powerful alliances across the globe and forces that turn old friends into foes.",2023-03-22,"Action, Thriller, Crime","new york city, martial arts, hitman, sequel, organized crime, osaka, japan, blindness, aftercreditsstinger, hunted, consequences, professional assassin, neo-noir, berlin, intense","The Super Mario Bros. Movie, Fast X, Guardians of the Galaxy Vol. 3, Avatar: The Way of Water, Dungeons & Dragons: Honor Among Thieves, John Wick, John Wick: Chapter 3 - Parabellum, Spider-Man: Across the Spider-Verse, The Flash, Extraction 2, John Wick: Chapter 2, Puss in Boots: The Last Wish, Ant-Man and the Wasp: Quantumania, Shazam! Fury of the Gods, Sisu, Creed III, Oppenheimer, Evil Dead Rise, Guy Ritchie's The Covenant, Transformers: Rise of the Beasts, 65","Donnie Yen, Bill Skarsgård, Keanu Reeves, Laurence Fishburne, Ian McShane",Chad Stahelski,"Starz Apple TV Channel, Starz Roku Premium Channel, Starz, Starz Amazon Channel ","Apple TV, Amazon Video, Google Play Movies, YouTube, Vudu, Microsoft Store ","Apple TV, Amazon Video, Google Play Movies, YouTube, Vudu, Microsoft Store, Spectrum On Demand ","Thunder Road, 87Eleven, Summit Entertainment, Studio Babelsberg",https://johnwick.movie
Mission: Impossible - Dead Reckoning Part One,164,en,"Ethan Hunt and his IMF team embark on their most dangerous mission yet: To track down a terrifying new weapon that threatens all of humanity before it falls into the wrong hands. With control of the future and the world's fate at stake and dark forces from Ethan's past closing in, a deadly race around the globe begins. Confronted by a mysterious, all-powerful enemy, Ethan must consider that nothing can matter more than his mission—not even the lives of those he cares about most.",2023-07-08,"Action, Thriller","race against time, mission, rome, italy, chase, secret mission, secret agent, sequel, intelligence agency, rogue agent, based on tv series, secret government agency, serious, northern norway, exhilarated","Oppenheimer, Barbie, The Equalizer 3, Expend4bles, Indiana Jones and the Dial of Destiny, Five Nights at Freddy's, Gran Turismo, Sound of Freedom, Meg 2: The Trench, John Wick: Chapter 4, Fast X, Mission: Impossible - Fallout, The Nun II, Guardians of the Galaxy Vol. 3, Transformers: Rise of the Beasts, Saw X, Blue Beetle, The Creator, Mission: Impossible, The Flash, Talk to Me","Tom Cruise, Rebecca Ferguson, Simon Pegg, Ving Rhames, Hayley Atwell",Christopher McQuarrie,"Paramount Plus, Paramount Plus Apple TV Channel , Paramount+ Amazon Channel, Paramount+ Roku Premium Channel ","Apple TV, Amazon Video, Google Play Movies, YouTube, Vudu, Microsoft Store ","Apple TV, Amazon Video, Google Play Movies, YouTube, Vudu, Microsoft Store, FlixFling, Spectrum On Demand ","Paramount, Skydance Media, TC Productions",https://www.paramountmovies.com/movies/mission-impossible-dead-reckoning
"Ruby Gillman, Teenage Kraken",91,en,"Ruby Gillman, a sweet and awkward high school student, discovers she's a direct descendant of the warrior kraken queens. The kraken are sworn to protect the oceans of the world against the vain, power-hungry mermaids. Destined to inherit the throne from her commanding grandmother, Ruby must use her newfound powers to protect those she loves most.",2023-06-28,"Animation, Family, Fantasy, Comedy","high school, ocean, boat, transformation, fisherman, mermaid, coming of age, prom, female protagonist, kraken, female villain, coastal town, fitting in, trident, 3d animation, teenager, animation","The Flash, Barbie, Elemental, Transformers: Rise of the Beasts, Teenage Mutant Ninja Turtles: Mutant Mayhem, Blue Beetle, The Super Mario Bros. Movie, Indiana Jones and the Dial of Destiny, The Little Mermaid, Insidious: The Red Door, Mission: Impossible - Dead Reckoning Part One, Oppenheimer, Spider-Man: Across the Spider-Verse, Guardians of the Galaxy Vol. 3, Resident Evil: Death Island, Fast X, Mavka: The Forest Song, Nimona, Trolls Band Together, Gran Turismo, Meg 2: The Trench","Liza Koshy, Toni Collette, Lana Condor, Annie Murphy, Sam Richardson",Kirk DeMicco,"Netflix, Netflix basic with Ads ","Apple TV, Amazon Video, Google Play Movies, YouTube, Vudu, Microsoft Store ","Apple TV, Amazon Video, Google Play Movies, YouTube, Vudu, Microsoft Store, FlixFling, Spectrum On Demand ","DreamWorks Animation, dentsu",https://www.teenagekrakenmovie.com
